tmdb_id,title,overview,release_date,poster_path,backdrop_path,vote_average,vote_count,popularity,revenue,runtime,genres,director,actors
35,The Simpsons Movie,"After Homer accidentally pollutes the town's water supply, Springfield is encased in a gigantic dome by the EPA and the Simpsons are declared fugitives.",2007-07-25,/s3b8TZWwmkYc2KoJ5zk77qB6PzY.jpg,/8ln5VUVk7gnNGIb2VNgw8nICDVt.jpg,7.0,8510,7.4197,,,,David Silverman,"Dan Castellaneta, Julie Kavner, Nancy Cartwright, Yeardley Smith, Hank Azaria"
124905,Godzilla,"Ford Brody, a Navy bomb expert, has just reunited with his family in San Francisco when he is forced to go to Japan to help his estranged father, Joe. Soon, both men are swept up in an escalating crisis when an ancient alpha predator arises from the sea to combat malevolent adversaries that threaten the survival of humanity. The creatures leave colossal destruction in their wake, as they make their way toward their final battleground: San Francisco.",2014-05-14,/tphkjmQq8WebuVwNXelmjLUXuPJ.jpg,/cHvwgJPaT59H1HiQsvBrGD5I46g.jpg,6.353,9728,9.8124,,,,Gareth Edwards,"Aaron Taylor-Johnson, Elizabeth Olsen, Juliette Binoche, Bryan Cranston, Ken Watanabe"
10528,Sherlock Holmes,Eccentric consulting detective Sherlock Holmes and Doctor John Watson battle to bring down a new nemesis and unravel a deadly plot that could destroy England.,2009-12-23,/momkKuWburNTqKBF6ez7rvhYVhE.jpg,/85g84VtSf9tu1A9JqqruXEHspb7.jpg,7.2,14719,8.2846,,,,Guy Ritchie,"Robert Downey Jr., Jude Law, Rachel McAdams, Mark Strong, Eddie Marsan"
635302,Demon Slayer -Kimetsu no Yaiba- The Movie: Mugen Train,"Tanjiro Kamado, joined with Inosuke Hashibira, a boy raised by boars who wears a boar's head, and Zenitsu Agatsuma, a scared boy who reveals his true power when he sleeps, boards the Infinity Train on a new mission with the Fire Hashira, Kyojuro Rengoku, to defeat a demon who has been tormenting the people and killing the demon slayers who oppose it!",2020-10-16,/h8Rb9gBr48ODIwYUttZNYeMWeUU.jpg,/xPpXYnCWfjkt3zzE0dpCNME1pXF.jpg,8.2,4461,8.9631,,,,Haruo Sotozaki,"Natsuki Hanae, Akari Kito, Hiro Shimono, Yoshitsugu Matsuoka, Satoshi Hino"
617126,The Fantastic 4: First Steps,"Against the vibrant backdrop of a 1960s-inspired, retro-futuristic world, Marvel's First Family is forced to balance their roles as heroes with the strength of their family bond, while defending Earth from a ravenous space god called Galactus and his enigmatic Herald, Silver Surfer.",2025-07-23,/abqOz6EL3yXyOOafCPZxjL1M5bQ.jpg,/s94NjfKkcSczZ1FembwmQZwsuwY.jpg,6.956,3260,24.4738,,,,Matt Shakman,"Pedro Pascal, Vanessa Kirby, Ebon Moss-Bachrach, Joseph Quinn, Ralph Ineson"
10681,WALL·E,"After hundreds of years doing what he was built for, WALL•E— a robot designed to clean up the earth—discovers a new purpose in life when he meets a sleek search robot named EVE. EVE comes to realize that WALL•E has inadvertently stumbled upon the key to the planet's future, and races back to space to report to the humans. Meanwhile, WALL•E chases EVE across the galaxy and sets into motion one of the most imaginative adventures ever brought to the big screen.",2008-06-22,/hbhFnRzzg6ZDmm8YAmxBnQpQIPh.jpg,/nYs4ZwnJBK4AgljhvzwNz7fpr3E.jpg,8.11,20169,18.3747,,,,Andrew Stanton,"Ben Burtt, Elissa Knight, Jeff Garlin, Fred Willard, John Ratzenberger"
140300,Kung Fu Panda 3,"While Po and his father are visiting a secret panda village, an evil spirit threatens all of China, forcing Po to form a ragtag army to fight back.",2016-01-23,/oajNi4Su39WAByHI6EONu8G8HYn.jpg,/s3FiHTdpQVpqIqdBxLLiy40wGut.jpg,6.921,6546,11.3702,,,,Jennifer Yuh Nelson,"Jack Black, Bryan Cranston, Dustin Hoffman, Angelina Jolie, J.K. Simmons"
102899,Ant-Man,"Armed with the astonishing ability to shrink in scale but increase in strength, master thief Scott Lang must embrace his inner-hero and help his mentor, Doctor Hank Pym, protect the secret behind his spectacular Ant-Man suit from a new generation of towering threats. Against seemingly insurmountable obstacles, Pym and Lang must plan and pull off a heist that will save the world.",2015-07-14,/rQRnQfUl3kfp78nCWq8Ks04vnq1.jpg,/1K3JmSNUN8OpjYsCjc0Hy0SYxAb.jpg,7.065,20802,11.8749,,,,Peyton Reed,"Paul Rudd, Michael Douglas, Evangeline Lilly, Corey Stoll, Bobby Cannavale"
280,Terminator 2: Judgment Day,"Ten years after the events of the original, a reprogrammed T-800 is sent back in time to protect young John Connor from the shape-shifting T-1000. Together with his mother Sarah, he fights to stop Skynet from triggering a nuclear apocalypse.",1991-07-03,/jFTVD4XoWQTcg7wdyJKa8PEds5q.jpg,/izkMjmhauFx9DjoBQqM5sM5WAwE.jpg,8.145,14179,23.8263,,,,James Cameron,"Arnold Schwarzenegger, Linda Hamilton, Edward Furlong, Robert Patrick, Earl Boen"
693,Meet the Fockers,"Hard-to-crack ex-CIA man Jack Byrnes and his wife Dina head for the warmer climes of Florida to meet the parents of their son-in-law-to-be, Greg Focker. Unlike their happily matched offspring, the future in-laws find themselves in a situation of opposites that definitely do not attract.",2004-12-22,/59fXm6N2x7QSbvt6BaBxTNBXGL8.jpg,/porZOny3iVvs5LK0osW1b52wWik.jpg,6.254,5130,6.9922,,,,Jay Roach,"Ben Stiller, Robert De Niro, Dustin Hoffman, Barbra Streisand, Blythe Danner"
313369,La La Land,"Mia, an aspiring actress, serves lattes to movie stars in between auditions and Sebastian, a jazz musician, scrapes by playing cocktail party gigs in dingy bars, but as success mounts they are faced with decisions that begin to fray the fragile fabric of their love affair, and the dreams they worked so hard to maintain in each other threaten to rip them apart.",2016-12-01,/uDO8zWDhfWwoFdKS4fzkUJt0Rf0.jpg,/nlPCdZlHtRNcF6C9hzUH4ebmV1w.jpg,7.898,18031,18.768,,,,Damien Chazelle,"Ryan Gosling, Emma Stone, John Legend, Rosemarie DeWitt, Finn Wittrock"
580489,Venom: Let There Be Carnage,"After finding a host body in investigative reporter Eddie Brock, the alien symbiote must face a new enemy, Carnage, the alter ego of serial killer Cletus Kasady.",2021-09-30,/pzKsRuKLFmYrW5Q0q8E8G78Tcgo.jpg,/eENEf62tMXbhyVvdcXlnQz2wcuT.jpg,6.746,11127,9.9068,,,,Andy Serkis,"Tom Hardy, Woody Harrelson, Michelle Williams, Naomie Harris, Reid Scott"
251,Ghost,"After a young man is murdered, his spirit stays behind to warn his lover of impending danger, with the help of a reluctant psychic.",1990-07-13,/w9RaPHov8oM5cnzeE27isnFMsvS.jpg,/6nLdSON3ErniBZTXWG7WRqs5jGz.jpg,7.233,5990,10.4004,,,,Jerry Zucker,"Patrick Swayze, Demi Moore, Whoopi Goldberg, Tony Goldwyn, Vincent Schiavelli"
812,Aladdin,"In the boorish city of Agrabah, kind-hearted street urchin Aladdin and Princess Jasmine fall in love, although she can only marry a prince. He and power-hungry Grand Vizier Jafar vie for a magic lamp that can fulfill their wishes.",1992-11-25,/eLFfl7vS8dkeG1hKp5mwbm37V83.jpg,/nenJjvfe2Eq8uBMXFJnWj5mw4bi.jpg,7.654,11969,18.0627,,,,John Musker,"Scott Weinger, Robin Williams, Linda Larkin, Jonathan Freeman, Gilbert Gottfried"
1357305,Detective Chinatown 1900,"In 1900, a white woman was murdered in Chinatown in San Francisco, and the suspect was a Chinese man. The murder caused social shock, and people demanded the closure of Chinatown.",2025-01-29,/g3GsgIlH3fA4RxhNOAMvSbVWyfW.jpg,/4xN3phAX024b251CPhy8zvsXbBc.jpg,6.3,96,3.528,,,,Chen Sicheng,"Wang Baoqiang, Liu Haoran, Chow Yun-Fat, White-K, Zhang Xincheng"
1462748,DUDURITMUS,A product of Collective Burnout created by the Cinema Department of ESTC.,,/zEmLmQq0EWLrqmVkyaQkQJ4v5Zj.jpg,/ysoMFM3hCy0OTdyWNgdR3zxlblc.jpg,0.0,0,0.0071,,,,DJANITA,
1432484,The World of the Pharaoh (Live Theatre),,2025-02-09,/yf7TLgUD0mKKZSKhCeuHKw6Up9f.jpg,,10.0,1,0.0,,,,Martín Cirio,Martín Cirio
1038392,The Conjuring: Last Rites,Paranormal investigators Ed and Lorraine Warren take on one last terrifying case involving mysterious entities they must confront.,2025-09-03,/byWgphT74ClOVa8EOGzYDkl8DVL.jpg,/tcBX2dtkNozZ0uDLVaxXrE6rqyN.jpg,6.884,1772,48.0913,,,,Michael Chaves,"Patrick Wilson, Vera Farmiga, Mia Tomlinson, Ben Hardy, Rebecca Calder"
172385,Rio 2,"It's a jungle out there for Blu, Jewel and their three kids after they're hurtled from Rio de Janeiro to the wilds of the Amazon. As Blu tries to fit in, he goes beak-to-beak with the vengeful Nigel, and meets the most fearsome adversary of all: his father-in-law.",2014-03-19,/gVNTBrjxh2YRmQFjlaqrNbHVvrd.jpg,/eg2jxQ1FFi6ENDfyMIMC5odpcU0.jpg,6.52,3737,7.0033,,,,Carlos Saldanha,"Jesse Eisenberg, Anne Hathaway, will.i.am, Jamie Foxx, Leslie Mann"
652,Troy,"In year 1250 B.C. during the late Bronze age, two emerging nations begin to clash. Paris, the Trojan prince, convinces Helen, Queen of Sparta, to leave her husband Menelaus, and sail with him back to Troy. After Menelaus finds out that his wife was taken by the Trojans, he asks his brother Agamemnon to help him get her back. Agamemnon sees this as an opportunity for power. They set off with 1,000 ships holding 50,000 Greeks to Troy.",2004-05-13,/51auXjXepW1zblzhaN7CAhwvf5i.jpg,/d3z8MH9OvTOOSxy5QwAG0cS6GKU.jpg,7.168,10979,19.5007,,,,Wolfgang Petersen,"Brad Pitt, Orlando Bloom, Eric Bana, Brian Cox, Sean Bean"
863,Toy Story 2,"Andy heads off to Cowboy Camp, leaving his toys to their own devices. Things shift into high gear when an obsessive toy collector named Al McWhiggen, owner of Al's Toy Barn kidnaps Woody. Andy's toys mount a daring rescue mission, Buzz Lightyear meets his match and Woody has to decide where he and his heart truly belong.",1999-10-30,/4rbcp3ng8n1MKHjpeqW0L7Fnpzz.jpg,/7iUDfakacY1HpajP1DtHrCuDB95.jpg,7.6,14814,16.2881,,,,John Lasseter,"Tom Hanks, Tim Allen, Joan Cusack, Kelsey Grammer, Don Rickles"
976573,Elemental,"In a city where fire, water, land and air residents live together, a fiery young woman and a go-with-the-flow guy will discover something elemental: how much they have in common.",2023-06-14,/4Y1WNkd88JXmGfhtWR7dmDAo1T2.jpg,/4fLZUr1e65hKPPVw0R3PmKFKxj1.jpg,7.577,5255,14.9222,,,,Peter Sohn,"Leah Lewis, Mamoudou Athie, Ronnie del Carmen, Shila Ommi, Wendi McLendon-Covey"
10191,How to Train Your Dragon,"As the son of a Viking leader on the cusp of manhood, shy Hiccup Horrendous Haddock III faces a rite of passage: he must kill a dragon to prove his warrior mettle. But after downing a feared dragon, he realizes that he no longer wants to destroy it, and instead befriends the beast – which he names Toothless – much to the chagrin of his warrior father.",2010-03-18,/ygGmAO60t8GyqUo9xYeYxSZAR3b.jpg,/59vDC1BuEQvti24OMr0ZvtAK6R1.jpg,7.858,14295,14.2922,,,,Chris Sanders,"Jay Baruchel, Gerard Butler, Craig Ferguson, America Ferrera, Jonah Hill"
664,Twister,"An unprecedented series of violent tornadoes is sweeping across Oklahoma. Tornado chasers, headed by Dr. Jo Harding, attempt to release a groundbreaking device that will allow them to track them and create a more advanced warning system. They are joined by Jo's soon to be ex-husband Bill, a former tornado chaser himself, and his girlfriend Melissa.",1996-05-10,/d4ie3f6QTvNw40V770Uzo87SDZn.jpg,/5oCAo7LFj2x0yByfi5JYirGnK8I.jpg,6.6,3823,7.6881,,,,Jan de Bont,"Helen Hunt, Bill Paxton, Jami Gertz, Cary Elwes, Lois Smith"
18823,Clash of the Titans,"Born of a god but raised as a man, Perseus is helpless to save his family from Hades, vengeful god of the underworld. With nothing to lose, Perseus volunteers to lead a dangerous mission to defeat Hades before he can seize power from Zeus and unleash hell on earth. Battling unholy demons and fearsome beasts, Perseus and his warriors will only survive if Perseus accepts his power as a god, defies fate and creates his own destiny.",2010-03-26,/6iHYLipwEyZUPNO8MM3l1yHDaFE.jpg,/hUUTJPmvBvBKILNLrBu16pRxr6M.jpg,5.916,6654,7.4992,,,,Louis Leterrier,"Sam Worthington, Gemma Arterton, Mads Mikkelsen, Alexa Davalos, Jason Flemyng"
939243,Sonic the Hedgehog 3,"Sonic, Knuckles, and Tails reunite against a powerful new adversary, Shadow, a mysterious villain with powers unlike anything they have faced before. With their abilities outmatched in every way, Team Sonic must seek out an unlikely alliance in hopes of stopping Shadow and protecting the planet.",2024-12-19,/d8Ryb8AunYAuycVKDp5HpdWPKgC.jpg,/zOpe0eHsq0A2NvNyBbtT6sj53qV.jpg,7.61,3236,23.6346,,,,Jeff Fowler,"Jim Carrey, Ben Schwartz, Keanu Reeves, Idris Elba, Colleen O'Shaughnessey"
68728,Oz the Great and Powerful,"Oscar Diggs, a small-time circus illusionist and con-artist, is whisked from Kansas to the Land of Oz where the inhabitants assume he's the great wizard of prophecy, there to save Oz from the clutches of evil.",2013-03-07,/tkzfAUEKoUp4YFNbZV9hfpZOz0z.jpg,/o6TYNmB1CT85j7lmyvSedoybyc9.jpg,5.933,6780,5.8231,,,,Sam Raimi,"James Franco, Mila Kunis, Rachel Weisz, Michelle Williams, Zach Braff"
420809,Maleficent: Mistress of Evil,"Maleficent and her goddaughter Aurora begin to question the complex family ties that bind them as they are pulled in different directions by impending nuptials, unexpected allies, and dark new forces at play.",2019-10-16,/vloNTScJ3w7jwNwtNGoG8DbTThv.jpg,/skvI4rYFrKXS73BJxWGH54Omlvv.jpg,7.295,6456,9.1269,,,,Joachim Rønning,"Angelina Jolie, Elle Fanning, Harris Dickinson, Michelle Pfeiffer, Sam Riley"
281338,War for the Planet of the Apes,"Caesar and his apes are forced into a deadly conflict with an army of humans led by a ruthless Colonel. After the apes suffer unimaginable losses, Caesar wrestles with his darker instincts and begins his own mythic quest to avenge his kind. As the journey finally brings them face to face, Caesar and the Colonel are pitted against each other in an epic battle that will determine the fate of both their species and the future of the planet.",2017-07-11,/3vYhLLxrTtZLysXtIWktmd57Snv.jpg,/w22CTHxmdAsUrXRbCQt4gOSOD6E.jpg,7.217,9680,8.8765,,,,Matt Reeves,"Andy Serkis, Woody Harrelson, Karin Konoval, Terry Notary, Steve Zahn"
808,Shrek,"It ain't easy bein' green -- especially if you're a likable (albeit smelly) ogre named Shrek. On a mission to retrieve a gorgeous princess from the clutches of a fire-breathing dragon, Shrek teams up with an unlikely compatriot -- a wisecracking donkey.",2001-05-18,/iB64vpL3dIObOtMZgX3RqdVdQDc.jpg,/40Wtp7kMG6mZ4d5T1jfrd8qrvD4.jpg,7.759,18640,27.115,,,,Andrew Adamson,"Mike Myers, Eddie Murphy, Cameron Diaz, John Lithgow, Vincent Cassel"
787,Mr. & Mrs. Smith,"A husband and wife struggle to keep their marriage alive until they realize they are both secretly working as assassins. Now, their respective assignments require them to kill each other.",2005-06-07,/kjD700RtyhveN3ZbOnSvUSne0Qj.jpg,/iFaWUETEE2umP1WY0LUAmjSpzm7.jpg,6.691,11164,17.2435,,,,Doug Liman,"Brad Pitt, Angelina Jolie, Vince Vaughn, Adam Brody, Kerry Washington"
13448,Angels & Demons,"Harvard symbologist Robert Langdon is recruited by the Vatican to investigate the apparent return of the Illuminati – a secret, underground organization – after four cardinals are kidnapped on the night of the papal conclave.",2009-04-20,/tFZQAuulEOtFTp0gHbVdEXwGrYe.jpg,/olz8Xw3yOLpBAHKgPoSRwmomdM.jpg,6.719,7288,8.8971,,,,Ron Howard,"Tom Hanks, Ewan McGregor, Ayelet Zurer, Stellan Skarsgård, Pierfrancesco Favino"
98566,Teenage Mutant Ninja Turtles,"When a kingpin threatens New York City, a group of mutated turtle warriors must emerge from the shadows to protect their home.",2014-08-07,/azL2ThbJMIkts3ZMt3j1YgBUeDB.jpg,/eezsbzYPbYKjjh6E1XHDBNlLynh.jpg,5.927,7159,9.0065,,,,Jonathan Liebesman,"Pete Ploszek, Alan Ritchson, Jeremy Howard, Noel Fisher, Megan Fox"
315162,Puss in Boots: The Last Wish,"Puss in Boots discovers that his passion for adventure has taken its toll: He has burned through eight of his nine lives, leaving him with only one life left. Puss sets out on an epic journey to find the mythical Last Wish and restore his nine lives.",2022-12-07,/kuf6dutpsT0vSVehic3EZIqkOBt.jpg,/jr8tSoJGj33XLgFBy6lmZhpGQNu.jpg,8.201,8762,16.1773,,,,Joel Crawford,"Antonio Banderas, Salma Hayek Pinault, Harvey Guillén, Wagner Moura, Florence Pugh"
310,Bruce Almighty,"Bruce Nolan toils as a ""human interest"" television reporter in Buffalo, NY, but despite his high ratings and the love of his beautiful girlfriend, Bruce remains unfulfilled. At the end of the worst day in his life, he angrily ridicules God — and the Almighty responds, endowing Bruce with all of His divine powers.",2003-05-23,/3XJKBKh9Km89EoUEitVTSnrlAkZ.jpg,/cgjLr9VVQzp0mYQ6IUc3JlZ8Frp.jpg,6.725,11441,8.3468,,,,Tom Shadyac,"Jim Carrey, Morgan Freeman, Jennifer Aniston, Philip Baker Hall, Catherine Bell"
46195,Rio,"Captured by smugglers when he was just a hatchling, a macaw named Blu never learned to fly and lives a happily domesticated life in Minnesota with his human friend, Linda. Blu is thought to be the last of his kind, but when word comes that Jewel, a lone female, lives in Rio de Janeiro, Blu and Linda go to meet her. Animal smugglers kidnap Blu and Jewel, but the pair soon escape and begin a perilous adventure back to freedom -- and Linda.",2011-04-03,/4nJxhUknKV8Gqdhov8pU1YWDYfb.jpg,/yoyLhm534GHsWvx5cNBDhfZdTG7.jpg,6.762,7141,11.6125,,,,Carlos Saldanha,"Jesse Eisenberg, Anne Hathaway, Leslie Mann, Jane Lynch, will.i.am"
857,Saving Private Ryan,"As U.S. troops storm the beaches of Normandy, three brothers lie dead on the battlefield, with a fourth trapped behind enemy lines. Ranger captain John Miller and seven men are tasked with penetrating German-held territory and bringing the boy home.",1998-07-24,/uqx37cS8cpHg8U35f9U5IBlrCV3.jpg,/bdD39MpSVhKjxarTxLSfX6baoMP.jpg,8.223,17122,15.6938,,,,Steven Spielberg,"Tom Hanks, Tom Sizemore, Edward Burns, Barry Pepper, Adam Goldberg"
61791,Rise of the Planet of the Apes,"A highly intelligent chimpanzee named Caesar has been living a peaceful suburban life ever since he was born. But when he gets taken to a cruel primate facility, Caesar decides to revolt against those who have harmed him.",2011-08-03,/oqA45qMyyo1TtrnVEBKxqmTPhbN.jpg,/6cCF0KMUO2QmrVsQFujkQduREXX.jpg,7.341,12694,9.0584,,,,Rupert Wyatt,"Andy Serkis, James Franco, Freida Pinto, John Lithgow, Brian Cox"
912649,Venom: The Last Dance,"Eddie and Venom are on the run. Hunted by both of their worlds and with the net closing in, the duo are forced into a devastating decision that will bring the curtains down on Venom and Eddie's last dance.",2024-10-22,/vGXptEdgZIhPg3cGlc7e8sNPC2e.jpg,/3V4kLQg0kSqPLctI5ziYWabAZYF.jpg,6.659,4154,19.6205,,,,Kelly Marcel,"Tom Hardy, Chiwetel Ejiofor, Juno Temple, Rhys Ifans, Stephen Graham"
771,Home Alone,"Eight-year-old Kevin McCallister makes the most of the situation after his family unwittingly leaves him behind when they go on Christmas vacation. When thieves try to break into his home, he puts up a fight like no other.",1990-11-16,/onTSipZ8R3bliBdKfPtsDuHTdlL.jpg,/ih2xVgeMS8R5WUetYE8Mr9hVTlB.jpg,7.464,12449,0.8496,,,,Chris Columbus,"Macaulay Culkin, Joe Pesci, Daniel Stern, John Heard, Roberts Blossom"
640146,Ant-Man and the Wasp: Quantumania,"Super-Hero partners Scott Lang and Hope van Dyne, along with with Hope's parents Janet van Dyne and Hank Pym, and Scott's daughter Cassie Lang, find themselves exploring the Quantum Realm, interacting with strange new creatures and embarking on an adventure that will push them beyond the limits of what they thought possible.",2023-02-15,/qnqGbB22YJ7dSs4o6M7exTpNxPz.jpg,/m8JTwHFwX7I7JY5fPe4SjqejWag.jpg,6.229,5784,8.9272,,,,Peyton Reed,"Paul Rudd, Evangeline Lilly, Michael Douglas, Michelle Pfeiffer, Jonathan Majors"
118,Charlie and the Chocolate Factory,"A young boy wins a tour through the most magnificent chocolate factory in the world, led by the world's most unusual candy maker.",2005-07-13,/iKP6wg3c6COUe8gYutoGG7qcPnO.jpg,/3nqxXZ7QixMeWoQD10cw6FZf277.jpg,7.038,16060,11.5146,,,,Tim Burton,"Johnny Depp, Freddie Highmore, David Kelly, Helena Bonham Carter, Noah Taylor"
89,Indiana Jones and the Last Crusade,"In 1938, an art collector appeals to eminent archaeologist Dr. Indiana Jones to embark on a search for the Holy Grail. Indy learns that a medieval historian has vanished while searching for it, and the missing man is his own father, Dr. Henry Jones Sr.. He sets out to rescue his father by following clues in the old man's notebook, which his father had mailed to him before he went missing. Indy arrives in Venice, where he enlists the help of a beautiful academic, Dr. Elsa Schneider, along with Marcus Brody and Sallah. Together they must stop the Nazis from recovering the power of eternal life and taking over the world!",1989-05-24,/sizg1AU8f8JDZX4QIgE4pjUMBvx.jpg,/12fvZHskx57kQfNEUXJ3v0flWYQ.jpg,7.851,11011,8.87,,,,Steven Spielberg,"Harrison Ford, Sean Connery, Denholm Elliott, Alison Doody, John Rhys-Davies"
254128,San Andreas,"In the aftermath of a massive earthquake in California, a rescue-chopper pilot makes a dangerous journey across the state in order to rescue his estranged daughter.",2015-05-27,/2Gfjn962aaFSD6eST6QU3oLDZTo.jpg,/zcySy6dnSmyqiichtDgO7AEeZoq.jpg,6.243,8980,6.8651,,,,Brad Peyton,"Dwayne Johnson, Alexandra Daddario, Carla Gugino, Ioan Gruffudd, Archie Panjabi"
159824,Hotel Transylvania 2,"When the old-old-old-fashioned vampire Vlad arrives at the hotel for an impromptu family get-together, Hotel Transylvania is in for a collision of supernatural old-school and modern day cool.",2015-09-21,/3nFnrivNgipSKZ8LZJJbRSlAcTR.jpg,/kFPWoBFBkVi3YDG8MyOOTrwGxPF.jpg,6.764,6104,8.2655,,,,Genndy Tartakovsky,"Adam Sandler, Andy Samberg, Selena Gomez, Kevin James, Steve Buscemi"
474350,It Chapter Two,"27 years after overcoming the malevolent supernatural entity Pennywise, the former members of the Losers' Club, who have grown up and moved away from Derry, are brought back together by a devastating phone call.",2019-09-04,/zfE0R94v1E8cuKAerbskfD3VfUt.jpg,/6LVSrgm83UYWlrLTCVGmWhFKYO0.jpg,6.838,9568,10.7989,,,,Andy Muschietti,"Jessica Chastain, James McAvoy, Bill Hader, Isaiah Mustafa, Jay Ryan"
82690,Wreck-It Ralph,"Wreck-It Ralph is the 9-foot-tall, 643-pound villain of an arcade video game named Fix-It Felix Jr., in which the game's titular hero fixes buildings that Ralph destroys. Wanting to prove he can be a good guy and not just a villain, Ralph escapes his game and lands in Hero's Duty, a first-person shooter where he helps the game's hero battle against alien invaders. He later enters Sugar Rush, a kart racing game set on tracks made of candies, cookies and other sweets. There, Ralph meets Vanellope von Schweetz who has learned that her game is faced with a dire threat that could affect the entire arcade, and one that Ralph may have inadvertently started.",2012-11-01,/fiHyt6UmG4yjcXFt9Cbpw6OedHh.jpg,/3IFRjBDwtk0DlIsDfJ2zEzLjUBi.jpg,7.356,13026,13.1911,,,,Rich Moore,"John C. Reilly, Sarah Silverman, Jack McBrayer, Jane Lynch, Alan Tudyk"
137106,The Lego Movie,"An ordinary Lego mini-figure, mistakenly thought to be the extraordinary MasterBuilder, is recruited to join a quest to stop an evil Lego tyrant from conquering the universe.",2014-02-06,/lbctonEnewCYZ4FYoTZhs8cidAl.jpg,/6gI1dAkOaUQ6659OdRPsTLlsem5.jpg,7.421,8418,14.4595,,,,Phil Lord,"Chris Pratt, Elizabeth Banks, Will Ferrell, Morgan Freeman, Will Arnett"
578,Jaws,"When the seaside community of Amity finds itself under attack by a dangerous great white shark, the town's chief of police, a young marine biologist, and a grizzled shark hunter embark on a desperate quest to kill the beast before it strikes again.",1975-06-20,/tjbLSFwi0I3phZwh8zoHWNfbsEp.jpg,/i1yf91svRHX45l9BXL8rVFzLoPH.jpg,7.682,11475,15.1623,,,,Steven Spielberg,"Roy Scheider, Robert Shaw, Richard Dreyfuss, Lorraine Gary, Murray Hamilton"
399566,Godzilla vs. Kong,"In a time when monsters walk the Earth, humanity’s fight for its future sets Godzilla and Kong on a collision course that will see the two most powerful forces of nature on the planet collide in a spectacular battle for the ages.",2021-03-24,/pgqgaUx1cJb5oZQQ5v0tNARCeBp.jpg,/wWqTMWkEw6HouLd1zPZbZWxtAPr.jpg,7.536,10579,12.1574,,,,Adam Wingard,"Alexander Skarsgård, Rebecca Hall, Kaylee Hottle, Brian Tyree Henry, Millie Bobby Brown"
18785,The Hangover,"When three friends finally come to after a raucous night of bachelor-party revelry, they find a baby in the closet and a tiger in the bathroom. But they can't seem to locate their best friend, Doug – who's supposed to be tying the knot. Launching a frantic search for Doug, the trio perseveres through a nasty hangover to try to make it to the church on time.",2009-06-02,/A0uS9rHR56FeBtpjVki16M5xxSW.jpg,/iuRVt8tFiXDPGgzavhuSa3QHRxD.jpg,7.33,18018,17.2131,,,,Todd Phillips,"Bradley Cooper, Ed Helms, Zach Galifianakis, Justin Bartha, Heather Graham"
240832,Lucy,"A woman, accidentally caught in a dark deal, turns the tables on her captors and transforms into a merciless warrior evolved beyond human logic.",2014-07-25,/kRbpUTRNm6QbLQFPFWUcNC4czEm.jpg,/1hzH1Wu2xhXBNOWzw3RMwNTJX5q.jpg,6.473,16999,11.2829,,,,Luc Besson,"Scarlett Johansson, Morgan Freeman, Choi Min-sik, Amr Waked, Julian Rhind-Tutt"
424783,Bumblebee,"On the run in the year 1987, Bumblebee finds refuge in a junkyard in a small Californian beach town. Charlie, on the cusp of turning 18 and trying to find her place in the world, discovers Bumblebee, battle-scarred and broken.  When Charlie revives him, she quickly learns this is no ordinary yellow VW bug.",2018-11-22,/fw02ONlDhrYjTSZV8XO6hhU3ds3.jpg,/hMANgfPHR1tRObNp2oPiOi9mMlz.jpg,6.7,6594,8.5283,,,,Travis Knight,"Dylan O'Brien, Hailee Steinfeld, John Cena, Jorge Lendeborg Jr., John Ortiz"
