tmdb_id,title,overview,release_date,poster_path,backdrop_path,vote_average,vote_count,popularity,revenue,runtime,genres,director,actors
4523,Enchanted,"The beautiful princess Giselle is banished by an evil queen from her magical, musical animated land and finds herself in the gritty reality of the streets of modern-day Manhattan. Shocked by this strange new environment that doesn't operate on a ""happily ever after"" basis, Giselle is now adrift in a chaotic world badly in need of enchantment. But when Giselle begins to fall in love with a charmingly flawed divorce lawyer who has come to her aid - even though she is already promised to a perfect fairy tale prince back home - she has to wonder: Can a storybook view of romance survive in the real world?",2007-11-20,/8KCNzCArLlvLdQoHx6npua2VSVc.jpg,/u4UpRDi0w84aNrigr9p049rMHiy.jpg,6.84,5685,7.8466,,,,Kevin Lima,"Amy Adams, Patrick Dempsey, James Marsden, Timothy Spall, Idina Menzel"
53182,300: Rise of an Empire,"Greek general Themistocles attempts to unite all of Greece by leading the charge that will change the course of the war. Themistocles faces the massive invading Persian forces led by mortal-turned-god, Xerxes and Artemesia, the vengeful commander of the Persian navy.",2014-03-05,/wYDdWN1McB1Sio4z1dPSkb40Z78.jpg,/chjkfyo57JexWo1YeIZRMk8wA4m.jpg,6.115,6920,6.9368,,,,Noam Murro,"Sullivan Stapleton, Eva Green, Lena Headey, Callan Mulvey, David Wenham"
1147596,Article 20,Tells the story of prosecutor Han Ming who is involved in a difficult case where the intentional injury of people is turned into a legitimate defense.,2024-02-10,/atUfcWtxyILttah3ItN329ouAU.jpg,/PsyMMWKOyMVjTZBiyhNebyHDsQ.jpg,6.944,54,1.6878,,,,Zhang Yimou,"Lei Jiayin, Ma Li, Zhao Liying, Gao Ye, Liu Yaowen"
695721,The Hunger Games: The Ballad of Songbirds & Snakes,"64 years before he becomes the tyrannical president of Panem, Coriolanus Snow sees a chance for a change in fortunes when he mentors Lucy Gray Baird, the female tribute from District 12.",2023-11-15,/mBaXZ95R2OxueZhvQbcEWy2DqyO.jpg,/8GnWDLn2AhnmkQ7hlQ9NJUYobSS.jpg,6.986,3472,9.698,,,,Francis Lawrence,"Tom Blyth, Rachel Zegler, Peter Dinklage, Jason Schwartzman, Hunter Schafer"
414,Batman Forever,"Batman faces off against two foes: the schizophrenic, horribly scarred former District Attorney Harvey Dent, aka Two-Face, and the Riddler, a disgruntled ex-Wayne Enterprises inventor seeking revenge against his former employer by unleashing his brain-sucking weapon on Gotham City's residents. As the caped crusader also copes with tortured memories of his parents' murder, he has a new romance, with psychologist Chase Meridian.",1995-06-16,/i0fJS8M5UKoETjjJ0zwUiKaR8tr.jpg,/snlu32RmjldF9b068UURJg8sQtn.jpg,5.5,5556,6.3725,,,,Joel Schumacher,"Val Kilmer, Tommy Lee Jones, Jim Carrey, Nicole Kidman, Chris O'Donnell"
9543,Prince of Persia: The Sands of Time,"A rogue prince reluctantly joins forces with a mysterious princess and together, they race against dark forces to safeguard an ancient dagger capable of releasing the Sands of Time – gift from the gods that can reverse time and allow its possessor to rule the world.",2010-05-19,/siNGMLdOUNYLEGtlsnmQcpO2XZX.jpg,/iP0capCU4w5nxCDl398CH7yR1r9.jpg,6.3,7131,5.4987,,,,Mike Newell,"Jake Gyllenhaal, Gemma Arterton, Ben Kingsley, Alfred Molina, Steve Toussaint"
4922,The Curious Case of Benjamin Button,"Born under unusual circumstances, Benjamin Button springs into being as an elderly man in a New Orleans nursing home and ages in reverse. Twelve years after his birth, he meets Daisy, a child who flits in and out of his life as she grows up to be a dancer. Though he has all sorts of unusual adventures over the course of his life, it is his relationship with Daisy, and the hope that they will come together at the right time, that drives Benjamin forward.",2008-12-25,/26wEWZYt6yJkwRVkjcbwJEFh9IS.jpg,/2fswjyrY3GEzeoVn6mF8pNeNcgf.jpg,7.598,13660,8.2511,,,,David Fincher,"Brad Pitt, Cate Blanchett, Taraji P. Henson, Julia Ormond, Jason Flemyng"
9802,The Rock,"When vengeful General Francis X. Hummel seizes control of Alcatraz Island and threatens to launch missiles loaded with deadly chemical weapons into San Francisco, only a young FBI chemical weapons expert and notorious Federal prisoner have the skills to penetrate the impregnable island fortress and take him down.",1996-06-07,/eBcoxveWzzXQrCrwWMGAROcqgpP.jpg,/1SsHEx1sCfVZY6Nj0sMyFTlEDql.jpg,7.143,5166,8.8915,,,,Michael Bay,"Sean Connery, Nicolas Cage, Ed Harris, John Spencer, David Morse"
291805,Now You See Me 2,"One year after outwitting the FBI and winning the public’s adulation with their mind-bending spectacles, the Four Horsemen resurface only to find themselves face to face with a new enemy who enlists them to pull off their most dangerous heist yet.",2016-06-02,/A81kDB6a1K86YLlcOtZB27jriJh.jpg,/oFQilRMEq6yQbtMPxIYWpXeQ5ZN.jpg,6.827,11531,12.329,,,,Jon M. Chu,"Jesse Eisenberg, Mark Ruffalo, Woody Harrelson, Dave Franco, Daniel Radcliffe"
58574,Sherlock Holmes: A Game of Shadows,"There is a new criminal mastermind at large (Professor Moriarty) and not only is he Holmes’ intellectual equal, but his capacity for evil and lack of conscience may give him an advantage over the detective.",2011-11-22,/y1MYZkwhZK6L0Jy4YMuPktzDOfn.jpg,/lWNASscWXn32Asr9vkB1wq6cKvD.jpg,7.144,10895,5.1236,,,,Guy Ritchie,"Robert Downey Jr., Jude Law, Noomi Rapace, Jared Harris, Rachel McAdams"
479306,Never Say Die,"A boxer and a journalist accidentally exchange bodies after they are struck by current, embarking a series of adventures.",2017-09-30,/i7lhHL8puIpgxtxBhFj8mKVeB9k.jpg,/lyGuft4aGUrCTvsOBNlvb6YcRCE.jpg,6.047,86,1.1464,,,,Zhang Chiyu,"Allen, Ma Li, Teng Shen, Xue Haowen, Chang Yuan"
1108211,Lost in the Stars,"He Fei's wife, Li Muzi, disappears during their anniversary trip. When she reappears, he insists that she is not his wife. As Chen Mai, a top lawyer gets involved in this bizarre case, more mysteries start to emerge.",2023-06-22,/88zdJKhD42Mpnd3if4RXYyILT9P.jpg,/T6MfrCWpEyDOpbNqILFT6MHxb3.jpg,6.6,100,2.0643,,,,Liu Xiang,"Zhu Yilong, Ni Ni, Janice Man Wing-San, Du Jiang, Huang Ziqi"
9738,Fantastic Four,"During a space voyage, four scientists are altered by cosmic rays: Reed Richards gains the ability to stretch his body; Sue Storm can become invisible; Johnny Storm controls fire; and Ben Grimm is turned into a super-strong … thing. Together, these ""Fantastic Four"" must now thwart the evil plans of Dr. Doom and save the world from certain destruction.",2005-06-29,/8HLQLILZLhDQWO6JDpvY6XJLH75.jpg,/2cDXXLirYsoP6rk9B8yrvNHbbFy.jpg,5.805,9945,7.4645,,,,Tim Story,"Ioan Gruffudd, Jessica Alba, Chris Evans, Michael Chiklis, Julian McMahon"
714,Tomorrow Never Dies,A deranged media mogul is staging international incidents to pit the world's superpowers against each other. Now James Bond must take on this evil mastermind in an adrenaline-charged battle to end his reign of terror and prevent global pandemonium.,1997-12-11,/gZm002w7q9yLOkltxT76TWGfdZX.jpg,/fesAgiKA0pc04vScDTAQe1f9nd4.jpg,6.378,3421,6.0951,,,,Roger Spottiswoode,"Pierce Brosnan, Jonathan Pryce, Michelle Yeoh, Teri Hatcher, Ricky Jay"
87,Indiana Jones and the Temple of Doom,"After arriving in India, Indiana Jones is asked by a desperate village to find a mystical stone. He agrees – and stumbles upon a secret cult plotting a terrible plan in the catacombs of an ancient palace.",1984-05-23,/gpdVNUaa4LhRMLfJOPj1AZdhAZ3.jpg,/f133nWlU6yUkZqqwcCXCbTEJWHr.jpg,7.308,10071,8.9676,,,,Steven Spielberg,"Harrison Ford, Kate Capshaw, Ke Huy Quan, Amrish Puri, Roshan Seth"
105864,The Good Dinosaur,An epic journey into the world of dinosaurs where an Apatosaurus named Arlo makes an unlikely human friend.,2015-11-14,/8RSkxOO80btfKjyiC5ZiTaCHIT8.jpg,/cF3H9pyUF6dsvqlYUcH0TyBAMTG.jpg,6.7,5952,14.7791,,,,Peter Sohn,"Frances McDormand, Raymond Ochoa, Jeffrey Wright, Steve Zahn, Sam Elliott"
331482,Little Women,Four sisters come of age in America in the aftermath of the Civil War.,2019-12-25,/yn5ihODtZ7ofn8pDYfxCmxh8AXI.jpg,/lqxxwTRk0l7CubY6JkJdhnwJEkn.jpg,7.854,6799,10.222,,,,Greta Gerwig,"Saoirse Ronan, Emma Watson, Florence Pugh, Eliza Scanlen, Laura Dern"
165,Back to the Future Part II,"Marty and Doc are at it again as the time-traveling duo head to 2015 to nip some McFly family woes in the bud. But things go awry thanks to bully Biff Tannen and a pesky sports almanac. In a last-ditch attempt to set things straight, Marty finds himself bound for 1955 and face to face with his teenage parents -- again.",1989-11-22,/hQq8xZe5uLjFzSBt4LanNP7SQjl.jpg,/w6tPctxWAsHoQXeKxxNOT6lYKpx.jpg,7.779,13858,9.22,,,,Robert Zemeckis,"Michael J. Fox, Christopher Lloyd, Lea Thompson, Thomas F. Wilson, Elisabeth Shue"
1184918,The Wild Robot,"After a shipwreck, an intelligent robot called Roz is stranded on an uninhabited island. To survive the harsh environment, Roz bonds with the island's animals and cares for an orphaned baby goose.",2024-09-12,/eG9lz41mJqsI4J6ubMtVqD26q2J.jpg,/mQZJoIhTEkNhCYAqcHrQqhENLdu.jpg,8.303,5972,25.8611,,,,Chris Sanders,"Lupita Nyong'o, Pedro Pascal, Kit Connor, Bill Nighy, Stephanie Hsu"
311324,The Great Wall,European mercenaries searching for black powder become embroiled in the defense of the Great Wall of China against a horde of monstrous creatures.,2016-12-16,/p70dq1YxabemdZDm5K6Q8G10wSn.jpg,/th26RNksfM9nn7DPH06OqiV6BA2.jpg,6.027,5511,7.1552,,,,Zhang Yimou,"Matt Damon, Jing Tian, Willem Dafoe, Andy Lau, Pedro Pascal"
550988,Free Guy,"A bank teller discovers he is actually a background player in an open-world video game, and decides to become the hero of his own story. Now, in a world where there are no limits, he is determined to be the guy who saves his world his way before it's too late.",2021-08-11,/dxraF0qPr1OEgJk17ltQTO84kQF.jpg,/7py8kUCYaOdFn1TfVS87BDBySOz.jpg,7.45,9738,14.0647,,,,Shawn Levy,"Ryan Reynolds, Jodie Comer, Lil Rel Howery, Joe Keery, Utkarsh Ambudkar"
187017,22 Jump Street,"After making their way through high school (twice), big changes are in store for officers Schmidt and Jenko when they go deep undercover at a local college. But when Jenko meets a kindred spirit on the football team, and Schmidt infiltrates the bohemian art major scene, they begin to question their partnership. Now they don't have to just crack the case - they have to figure out if they can have a mature relationship. If these two overgrown adolescents can grow from freshmen into real men, college might be the best thing that ever happened to them.",2014-06-05,/850chzYHYbT3IISl6Q7dbBuFP2B.jpg,/kdyYOwpKvvD2fSbwfnMM2YPAzfq.jpg,6.825,8487,6.9159,,,,Phil Lord,"Jonah Hill, Channing Tatum, Peter Stormare, Wyatt Russell, Amber Stevens West"
1597,Meet the Parents,"Greg Focker is ready to marry his girlfriend, Pam, but before he pops the question, he must win over her formidable father, humorless former CIA agent Jack Byrnes, at the wedding of Pam's sister. As Greg bends over backward to make a good impression, his visit to the Byrnes home turns into a hilarious series of disasters, and everything that can go wrong does, all under Jack's critical, hawklike gaze.",2000-10-06,/5tXJ9ctuyEOMUFLaeqRisbXowWs.jpg,/qcVrlyPFlPgCsmzorvELvpJN9Be.jpg,6.694,6358,7.2716,,,,Jay Roach,"Ben Stiller, Robert De Niro, Teri Polo, Blythe Danner, Nicole DeHuff"
1163194,Lost Ladies,"In 2001, somewhere in rural India, two young brides get accidentally swapped on a train. In the ensuing chaos, they both encounter a host of colourful characters, resulting in hilarious and unexpected consequences.",2024-03-01,/cGG5hCwPnMvuKzvUBnxo5y3DcVM.jpg,/uUVXEEyMsyWxrcbmAppUCYg6egV.jpg,7.783,145,1.1659,,,,Kiran Rao,"Nitanshi Goel, Pratibha Ranta, Sparsh Shrivastava, Ravi Kishan, Chhaya Kadam"
856,Who Framed Roger Rabbit,"'Toon star Roger is worried that his wife Jessica is playing pattycake with someone else, so the studio hires detective Eddie Valiant to snoop on her. But the stakes are quickly raised when Marvin Acme is found dead and Roger is the prime suspect.",1988-06-22,/lYfRc57Kx9VgLZ48iulu0HKnM15.jpg,/udIE8Cdon9wnYmVIOFYrBPfA2Mq.jpg,7.537,6145,7.7057,,,,Robert Zemeckis,"Bob Hoskins, Christopher Lloyd, Joanna Cassidy, Charles Fleischer, Kathleen Turner"
44214,Black Swan,"The story of Nina, a ballerina in a New York City ballet company whose life, like all those in her profession, is completely consumed with dance. She lives with her retired ballerina mother Erica who zealously supports her daughter's professional ambition. When artistic director Thomas Leroy decides to replace prima ballerina Beth MacIntyre for the opening production of their new season, Swan Lake, Nina is his first choice.",2010-12-03,/viWheBd44bouiLCHgNMvahLThqx.jpg,/g0geLM1zXpLb9mpqKw1ePcA5bTJ.jpg,7.685,15496,10.3325,,,,Darren Aronofsky,"Natalie Portman, Mila Kunis, Vincent Cassel, Barbara Hershey, Winona Ryder"
2133,The Perfect Storm,"In October 1991, a confluence of weather conditions combined to form a killer storm in the North Atlantic. Caught in the storm was the sword-fishing boat Andrea Gail.",2000-06-29,/vJPoxqgpfFNbGi0HyoNsjFeLCio.jpg,/tO1wEUOSmZLyttwkhOMzUxTiR7k.jpg,6.481,2541,5.2464,,,,Wolfgang Petersen,"George Clooney, Mark Wahlberg, Diane Lane, John C. Reilly, William Fichtner"
458156,John Wick: Chapter 3 - Parabellum,"Super-assassin John Wick returns with a $14 million price tag on his head and an army of bounty-hunting killers on his trail. After killing a member of the shadowy international assassin’s guild, the High Table, John Wick is excommunicado, but the world’s most ruthless hit men and women await his every turn.",2019-05-15,/ziEuG1essDuWuC5lpWUaw1uXY2O.jpg,/vVpEOvdxVBP2aV166j5Xlvb5Cdc.jpg,7.437,11664,12.2919,,,,Chad Stahelski,"Keanu Reeves, Halle Berry, Ian McShane, Laurence Fishburne, Mark Dacascos"
9671,Crocodile Dundee,"When a New York reporter plucks crocodile hunter Mick Dundee from the Australian Outback for a visit to the Big Apple, it's a clash of cultures and a recipe for good-natured comedy as naïve Dundee negotiates the concrete jungle. He proves that his instincts are quite useful in the city and adeptly handles everything from wily muggers to high-society snoots without breaking a sweat.",1986-09-26,/pduPduL1ub5kok3lPYT15ryC9L6.jpg,/fdyRR3R1urnk6oYiChCMu6bFaFb.jpg,6.442,2104,5.7192,,,,Peter Faiman,"Paul Hogan, Linda Kozlowski, Mark Blum, David Gulpilil, Michael Lombard"
807,Se7en,"Two homicide detectives are on a desperate hunt for a serial killer whose crimes are based on the ""seven deadly sins"" in this dark and haunting film that takes viewers from the tortured remains of one victim to the next. The seasoned Det. Somerset researches each sin in an effort to get inside the killer's mind, while his novice partner, Mills, scoffs at his efforts to unravel the case.",1995-09-22,/191nKfP0ehp3uIvWqgPbFmI4lv9.jpg,/i5H7zusQGsysGQ8i6P361Vnr0n2.jpg,8.38,22969,22.1599,,,,David Fincher,"Morgan Freeman, Brad Pitt, Gwyneth Paltrow, John Cassini, Peter Crombie"
350,The Devil Wears Prada,"A young woman from the Midwest gets more than she bargained for when she moves to New York to become a writer and ends up as the assistant to the tyrannical, larger-than-life editor-in-chief of a major fashion magazine.",2006-06-29,/8912AsVuS7Sj915apArUFbv6F9L.jpg,/gkh6Nt8DtY1XT4gQsyFq9XAVJlJ.jpg,7.389,13144,247.6948,,,,David Frankel,"Meryl Streep, Anne Hathaway, Emily Blunt, Stanley Tucci, Simon Baker"
116149,Paddington,"A young Peruvian bear travels to London in search of a home. Finding himself lost and alone at Paddington Station, he meets the kindly Brown family, who offer him a temporary haven.",2014-11-24,/wpchRGhRhvhtU083PfX2yixXtiw.jpg,/kfofK4GzJsJZhCShqZY438c8Y4Y.jpg,7.119,4211,5.1869,,,,Paul King,"Ben Whishaw, Hugh Bonneville, Sally Hawkins, Madeleine Harris, Samuel Joslin"
260346,Taken 3,"Ex-government operative Bryan Mills finds his life is shattered when he's falsely accused of a murder that hits close to home. As he's pursued by a savvy police inspector, Mills employs his particular set of skills to track the real killer and exact his unique brand of justice.",2014-12-16,/vzvMXMypMq7ieDofKThsxjHj9hn.jpg,/vFm4pF0BgaWPj0i2zEiZO6TqEQ0.jpg,6.3,6110,11.066,,,,Olivier Megaton,"Liam Neeson, Forest Whitaker, Maggie Grace, Dougray Scott, Famke Janssen"
10545,The Hunchback of Notre Dame,"Isolated bell-ringer Quasimodo wishes to leave Notre Dame tower against the wishes of Judge Claude Frollo, his stern guardian and Paris' strait-laced Minister of Justice. His first venture to the outside world finds him Esmeralda, a kind-hearted and fearless Romani woman who openly stands up to Frollo's tyranny.",1996-06-21,/hImMgT9B27evYSRmfztqdDtX6qi.jpg,/gANMasppEDQk95SvLsFNHtfBYNy.jpg,7.125,5337,7.3998,,,,Gary Trousdale,"Tom Hulce, Demi Moore, Kevin Kline, Tony Jay, Charles Kimbrough"
17979,A Christmas Carol,"Miser Ebenezer Scrooge is awakened on Christmas Eve by spirits who reveal to him his own miserable existence, what opportunities he wasted in his youth, his current cruelties, and the dire fate that awaits him if he does not change his ways. Scrooge is faced with his own story of growing bitterness and meanness, and must decide what his own future will hold: death or redemption.",2009-11-04,/xNwlAIdx1Ln28GRiQttUP9Gojy2.jpg,/uocpNfrP0Vvnf2UxykXuIR1HNUd.jpg,6.905,4885,4.0802,,,,Robert Zemeckis,"Jim Carrey, Gary Oldman, Colin Firth, Robin Wright, Cary Elwes"
228165,The SpongeBob Movie: Sponge Out of Water,"Evil pirate Burger Beard is in search of the final page of a magical book that makes any evil plan he writes in it come true, but the final page happens to be the Krabby Patty secret formula. When Burger Beard endangers Bikini Bottom, SpongeBob, Patrick, Mr. Krabs, Squidward, Sandy, and Plankton must embark on a quest to retrieve the recipe and save their city...a quest that takes them to the surface world and transforms them into superheroes.",2015-01-28,/2WDmjUlSAPlA27i2OwEC7sRTFw3.jpg,/sqcqFzAj3IPSFprQSLHr5JOBU4m.jpg,6.098,2518,5.1961,,,,Paul Tibbitt,"Tom Kenny, Bill Fagerbakke, Rodger Bumpass, Clancy Brown, Mr. Lawrence"
259693,The Conjuring 2,Lorraine and Ed Warren travel to north London to help a single mother raising four children alone in a house plagued by malicious spirits.,2016-06-08,/zEqyD0SBt6HL7W9JQoWwtd5Do1T.jpg,/mFCS5OuhPYT79KXu5jl7RqznPR1.jpg,7.292,9129,14.1913,,,,James Wan,"Vera Farmiga, Patrick Wilson, Madison Wolfe, Frances O'Connor, Lauren Esposito"
38055,Megamind,"After Megamind, a highly intelligent alien supervillain, defeats his long-time nemesis Metro Man, Megamind creates a new hero to fight, but must act to save the city when his ""creation"" becomes an even worse villain than he was.",2010-10-28,/uZ9ytt3sPTx62XTfN56ILSuYWRe.jpg,/irpJXGiVr539uuspcQcNdkhS2lq.jpg,7.022,7433,10.7603,,,,Tom McGrath,"Will Ferrell, Brad Pitt, Tina Fey, Jonah Hill, David Cross"
490132,Green Book,"Tony Lip, a bouncer in 1962, is hired to drive pianist Don Shirley on a tour through the Deep South in the days when African Americans, forced to find alternate accommodations and services due to segregation laws below the Mason-Dixon Line, relied on a guide called The Negro Motorist Green Book.",2018-11-16,/7BsvSuDQuoqhWmU2fL7W2GOcZHU.jpg,/5En0fmDagt3Pk8d7P3uTwfeQceg.jpg,8.223,12803,12.9744,,,,Peter Farrelly,"Viggo Mortensen, Mahershala Ali, Linda Cardellini, Sebastian Maniscalco, Dimiter D. Marinov"
943,Lethal Weapon 3,Riggs and Murtaugh pursue a former officer who uses his knowledge of police procedure and policies to steal and sell confiscated guns and ammunition to local street gangs.,1992-05-15,/smzJxEnusgqv3bvHIWwf4cuwPcr.jpg,/kmt9XmhmX36sJduuDVFlTgEWh9U.jpg,6.714,3213,4.7008,,,,Richard Donner,"Mel Gibson, Danny Glover, Joe Pesci, Rene Russo, Stuart Wilson"
20943,The Ugly Truth,"A romantically challenged morning show producer is reluctantly embroiled in a series of outrageous tests by her chauvinistic correspondent to prove his theories on relationships and help her find love. His clever ploys, however, lead to an unexpected result.",2009-07-24,/2rq96Ihbqb1eU3TEBVtgFlqbeX7.jpg,/wawOB6twz3K0vAsjGnZc6fTghFM.jpg,6.505,3749,4.8906,,,,Robert Luketic,"Katherine Heigl, Gerard Butler, Eric Winter, Nick Searcy, Bree Turner"
20662,Robin Hood,"When soldier Robin happens upon the dying Robert of Loxley, he promises to return the man's sword to his family in Nottingham. There, he assumes Robert's identity; romances his widow, Marion; and draws the ire of the town's sheriff and King John's henchman, Godfrey.",2010-05-12,/ldOLoEroWISvPvqTY2IgnuEUWTq.jpg,/gOi18HJqiuOYoXMH4CgpFnTHgUJ.jpg,6.396,4994,7.1394,,,,Ridley Scott,"Russell Crowe, Cate Blanchett, Max von Sydow, William Hurt, Mark Strong"
16869,Inglourious Basterds,"In Nazi-occupied France during World War II, a group of Jewish-American soldiers known as ""The Basterds"" are chosen specifically to spread fear throughout the Third Reich by scalping and brutally killing Nazis. The Basterds, lead by Lt. Aldo Raine soon cross paths with a French-Jewish teenage girl who runs a movie theater in Paris which is targeted by the soldiers.",2009-08-02,/7sfbEnaARXDDhKm0CZ7D7uc2sbo.jpg,/hwNtEmmugU5Yd7hpfprNWI0DGIn.jpg,8.217,24064,17.421,,,,Quentin Tarantino,"Brad Pitt, Mélanie Laurent, Christoph Waltz, Eli Roth, Michael Fassbender"
424,Schindler's List,The true story of how businessman Oskar Schindler saved over a thousand Jewish lives from the Nazis while they worked as slaves in his factory during World War II.,1993-12-15,/sF1U4EUQS8YHUYjNl3pMGNIQyr0.jpg,/zb6fM1CX41D9rF9hdgclu0peUmy.jpg,8.568,17379,27.601,,,,Steven Spielberg,"Liam Neeson, Ben Kingsley, Ralph Fiennes, Caroline Goodall, Jonathan Sagall"
138843,The Conjuring,"Paranormal investigators Ed and Lorraine Warren work to help a family terrorized by a dark presence in their farmhouse. Forced to confront a powerful entity, the Warrens find themselves caught in the most terrifying case of their lives.",2013-07-18,/wVYREutTvI2tmxr6ujrHT704wGF.jpg,/ecKQlAEG95k62SMGhvX83oEqANK.jpg,7.536,12645,19.6617,,,,James Wan,"Vera Farmiga, Patrick Wilson, Lili Taylor, Ron Livingston, Hayley McFarland"
11674,101 Dalmatians,"An evil, high-fashion designer plots to steal Dalmatian puppies in order to make an extravagant fur coat, but instead creates an extravagant mess.",1996-11-27,/8o2ADoAyG796UwTjwBFjPyBz0yG.jpg,/yqh3mb9jd3GTTs09ZlnW4mxS95z.jpg,5.942,3618,8.1915,,,,Stephen Herek,"Glenn Close, Jeff Daniels, Joely Richardson, Joan Plowright, Hugh Laurie"
10998,Fatal Attraction,A married man's one-night stand comes back to haunt him when that lover begins to stalk him and his family.,1987-09-18,/vjB9XwJKnYqFKKjhWcE6WpAf5Ki.jpg,/2UlBdiveZcOVrlNe5MYcI6TYeA7.jpg,6.846,1680,4.767,,,,Adrian Lyne,"Michael Douglas, Glenn Close, Anne Archer, Ellen Hamilton Latzen, Stuart Pankin"
454626,Sonic the Hedgehog,"Powered with incredible speed, Sonic The Hedgehog embraces his new home on Earth. That is, until Sonic sparks the attention of super-uncool evil genius Dr. Robotnik. Now it’s super-villain vs. super-sonic in an all-out race across the globe to stop Robotnik from using Sonic’s unique power for world domination.",2020-02-12,/aQvJ5WPzZgYVDrxLX4R6cLJCEaQ.jpg,/stmYfCUGd8Iy6kAMBr6AmWqx8Bq.jpg,7.285,10358,12.8015,,,,Jeff Fowler,"Ben Schwartz, James Marsden, Tika Sumpter, Jim Carrey, Natasha Rothwell"
10196,The Last Airbender,"A century has passed since the Fire Nation declared war on the other three nations of air, water, and earth in its attempt for global domination. Aang, the long-lost Avatar, is found by Water Tribe siblings Katara and Sokka and must learn to master water, earth, and fire bending to defeat the Fire Nation and restore balance to the world.",2010-06-30,/kl9JJ8288bNsY8oqT1SpQh1w2mb.jpg,/gU5cR9LKtDD8YvzE7T7GvmzCEAA.jpg,4.647,4246,8.2441,,,,M. Night Shyamalan,"Noah Ringer, Dev Patel, Nicola Peltz, Jackson Rathbone, Shaun Toub"
5255,The Polar Express,"When a doubting young boy takes an extraordinary train ride to the North Pole, he embarks on a journey of self-discovery that shows him that the wonder of life never fades for those who believe.",2004-11-10,/eOoCzH0MqeGr2taUZO4SwG416PF.jpg,/jtOvTVlkF8TlaOq94oNXRc9u2yp.jpg,6.723,6853,7.3647,,,,Robert Zemeckis,"Tom Hanks, Leslie Zemeckis, Eddie Deezen, Nona Gaye, Peter Scolari"
574475,Final Destination Bloodlines,"Plagued by a violent recurring nightmare, college student Stefanie heads home to track down the one person who might be able to break the cycle and save her family from the grisly demise that inevitably awaits them all.",2025-05-14,/6WxhEvFsauuACfv8HyoVX6mZKFj.jpg,/uIpJPDNFoeX0TVml9smPrs9KUVx.jpg,7.046,2797,20.9535,,,,Adam B. Stein,"Kaitlyn Santa Juana, Teo Briones, Rya Kihlstedt, Richard Harmon, Owen Patrick Joyner"
18240,The Proposal,"When she learns she's in danger of losing her visa status and being deported, overbearing book editor Margaret Tate forces her put-upon assistant, Andrew Paxton, to marry her.",2009-06-02,/6stnAm1wSek8ZrislwK4xGTyCnt.jpg,/ojgXOhVi9Yk8irDpRfDkIzdD1LK.jpg,7.1,7418,13.9754,,,,Anne Fletcher,"Sandra Bullock, Ryan Reynolds, Malin Åkerman, Craig T. Nelson, Mary Steenburgen"
453,A Beautiful Mind,"From the heights of notoriety to the depths of depravity, John Forbes Nash Jr. experiences it all. As a brilliant but socially awkward mathematician, he made a groundbreaking discovery early in his career and stands on the brink of international acclaim. But as the handsome and arrogant Nash accepts secret work in cryptography, he becomes entangled in a mysterious conspiracy. His life takes a nightmarish turn and he soon finds himself on a painful and harrowing journey of self-discovery.",2001-12-14,/zwzWCmH72OSC9NA0ipoqw5Zjya8.jpg,/vVBcIN68kFq681b4lObiNJhEVro.jpg,7.854,11028,8.3702,,,,Ron Howard,"Russell Crowe, Jennifer Connelly, Ed Harris, Paul Bettany, Christopher Plummer"
