tmdb_id,title,overview,release_date,poster_path,backdrop_path,vote_average,vote_count,popularity,revenue,runtime,genres,director,actors
19995,Avatar,"In the 22nd century, a paraplegic Marine is dispatched to the moon Pandora on a unique mission, but becomes torn between following orders and protecting an alien civilization.",2009-12-16,/gKY6q7SjCkAU6FqvqWybDYgUKIF.jpg,/vL5LR6WdxWPjLPFRLe133jXWsh5.jpg,7.602,33857,28.7787,,,,James Cameron,"Sam Worthington, Zoe Saldaña, Sigourney Weaver, Stephen Lang, Michelle Rodriguez"
299534,Avengers: Endgame,"After the devastating events of Avengers: Infinity War, the universe is in ruins due to the efforts of the Mad Titan, Thanos. With the help of remaining allies, the Avengers must assemble once more in order to undo Thanos' actions and restore order to the universe once and for all, no matter what consequences may be in store.",2019-04-24,/ulzhLuWrPK07P1YkdWQLZnQh1JL.jpg,/7RyHsO4yDXtBv1zUU3mTpHeQ0d5.jpg,8.234,27600,37.8048,,,,Anthony Russo,"Robert Downey Jr., Chris Evans, Mark Ruffalo, Chris Hemsworth, Scarlett Johansson"
76600,Avatar: The Way of Water,"Set more than a decade after the events of the first film, learn the story of the Sully family (Jake, Neytiri, and their kids), the trouble that follows them, the lengths they go to keep each other safe, the battles they fight to stay alive, and the tragedies they endure.",2022-12-14,/t6HIqrRAclMCA60NsSmeqe9RmNV.jpg,/kJsPVzdyBrYHLomuNv5SJDXUQ2f.jpg,7.592,14028,26.1734,,,,James Cameron,"Sam Worthington, Zoe Saldaña, Sigourney Weaver, Stephen Lang, Kate Winslet"
597,Titanic,"101-year-old Rose DeWitt Bukater tells the story of her life aboard the Titanic, 84 years later. A young Rose boards the ship with her mother and fiancé. Meanwhile, Jack Dawson and Fabrizio De Rossi win third-class tickets aboard the ship. Rose tells the whole story from Titanic's departure through to its death—on its first and last voyage—on April 15, 1912.",1997-12-18,/9xjZS2rlVxm8SFx8kPC3aIGCOYQ.jpg,/qBChUbS8ksbJoPTfZpogsnxG5tY.jpg,7.902,27061,31.3919,,,,James Cameron,"Leonardo DiCaprio, Kate Winslet, Billy Zane, Kathy Bates, Frances Fisher"
980477,Ne Zha 2,"After a catastrophic event leaves their bodies destroyed, Ne Zha and Ao Bing are granted a fragile second chance at life. As tensions rise between the dragon clans and celestial forces, the two must undergo a series of perilous trials that will test their bond, challenge their identities, and decide the fate of both mortals and immortals.",2025-01-29,/cb5NyNrqiCNNoDkA8FfxHAtypdG.jpg,/8btfz81bOJ2lC7cujYBTw03wzg3.jpg,8.122,660,30.3905,,,,Jiao Zi,"Lu Yanting, Joseph, Han Mo, Chen Hao, Lu Qi"
140607,Star Wars: The Force Awakens,"Thirty years after defeating the Galactic Empire, Han Solo and his allies face a new threat from the evil Kylo Ren and his army of Stormtroopers.",2015-12-15,/wqnLdwVXoBjKibFRR5U3y0aDUhs.jpg,/8BTsTfln4jlQrLXUBquXJ0ASQy9.jpg,7.25,20468,12.2283,,,,J.J. Abrams,"Daisy Ridley, John Boyega, Oscar Isaac, Adam Driver, Carrie Fisher"
299536,Avengers: Infinity War,"As the Avengers and their allies have continued to protect the world from threats too large for any one hero to handle, a new danger has emerged from the cosmic shadows: Thanos. A despot of intergalactic infamy, his goal is to collect all six Infinity Stones, artifacts of unimaginable power, and use them to inflict his twisted will on all of reality. Everything the Avengers have fought for has led up to this moment - the fate of Earth and existence itself has never been more uncertain.",2018-04-25,/7WsyChQLEftFiDOVTGkv3hFpyyt.jpg,/mDfJG3LC3Dqb67AZ52x3Z0jU0uB.jpg,8.234,31829,50.5036,,,,Anthony Russo,"Robert Downey Jr., Chris Evans, Chris Hemsworth, Josh Brolin, Mark Ruffalo"
634649,Spider-Man: No Way Home,"Peter Parker is unmasked and no longer able to separate his normal life from the high-stakes of being a super-hero. When he asks for help from Doctor Strange the stakes become even more dangerous, forcing him to discover what it truly means to be Spider-Man.",2021-12-15,/1g0dhYtq4irTY1GPXvft6k4YLjm.jpg,/zD5v1E4joAzFvmAEytt7fM3ivyT.jpg,7.933,21878,47.6255,,,,Jon Watts,"Tom Holland, Zendaya, Benedict Cumberbatch, Jacob Batalon, Jon Favreau"
1084242,Zootopia 2,"After cracking the biggest case in Zootopia's history, rookie cops Judy Hopps and Nick Wilde find themselves on the twisting trail of a great mystery when Gary De'Snake arrives and turns the animal metropolis upside down. To crack the case, Judy and Nick must go undercover to unexpected new parts of town, where their growing partnership is tested like never before.",2025-11-26,/oJ7g2CifqpStmoYQyaLQgEU32qO.jpg,/lgotja3xMoJZbynwHfcQcJAEMWH.jpg,7.606,2652,122.0814,,,,Jared Bush,"Ginnifer Goodwin, Jason Bateman, Ke Huy Quan, Fortune Feimster, Andy Samberg"
1022789,Inside Out 2,"Teenager Riley's mind headquarters is undergoing a sudden demolition to make room for something entirely unexpected: new Emotions! Joy, Sadness, Anger, Fear and Disgust, who’ve long been running a successful operation by all accounts, aren’t sure how to feel when Anxiety shows up. And it looks like she’s not alone.",2024-06-11,/vpnVM9B6NMmQpWeZvzLvDESb2QY.jpg,/p5ozvmdgsmbWe0H8Xk7Rc8SCwAB.jpg,7.544,6626,29.6771,,,,Kelsey Mann,"Amy Poehler, Maya Hawke, Kensington Tallman, Liza Lapira, Tony Hale"
135397,Jurassic World,"Twenty-two years after the events of Jurassic Park, Isla Nublar now features a fully functioning dinosaur theme park, Jurassic World, as originally envisioned by John Hammond.",2015-06-06,/rhr4y79GpxQF9IsfJItRXVaoGs4.jpg,/s5QfDFqRO6sjgPtKkjxD0WqXQef.jpg,6.698,21501,10.3121,,,,Colin Trevorrow,"Chris Pratt, Bryce Dallas Howard, Irrfan Khan, Vincent D'Onofrio, Ty Simpkins"
420818,The Lion King,"Simba idolizes his father, King Mufasa, and takes to heart his own royal destiny. But not everyone in the kingdom celebrates the new cub's arrival. Scar, Mufasa's brother—and former heir to the throne—has plans of his own. The battle for Pride Rock is ravaged with betrayal, tragedy and drama, ultimately resulting in Simba's exile. With help from a curious pair of newfound friends, Simba will have to figure out how to grow up and take back what is rightfully his.",2019-07-12,/dzBtMocZuJbjLOXvrl4zGYigDzh.jpg,/1TUg5pO1VZ4B0Q1amk3OlXvlpXV.jpg,7.098,10718,16.3294,,,,Jon Favreau,"Chiwetel Ejiofor, John Oliver, Donald Glover, James Earl Jones, John Kani"
24428,The Avengers,"When an unexpected enemy emerges and threatens global safety and security, Nick Fury, director of the international peacekeeping agency known as S.H.I.E.L.D., finds himself in need of a team to pull the world back from the brink of disaster. Spanning the globe, a daring recruitment effort begins!",2012-04-25,/RYMX2wcKCBAr24UyPD7xwmjaTn.jpg,/9BBTo63ANSmhC4e6r62OJFuK2GL.jpg,8.014,37576,52.5169,,,,Joss Whedon,"Robert Downey Jr., Chris Evans, Mark Ruffalo, Chris Hemsworth, Scarlett Johansson"
168259,Furious 7,Deckard Shaw seeks revenge against Dominic Toretto and his family for his comatose brother.,2015-04-01,/ktofZ9Htrjiy0P6LEowsDaxd3Ri.jpg,/ehzI1mVcnHqB58NqPyQwpMqcVoz.jpg,7.217,11237,15.5603,,,,James Wan,"Vin Diesel, Paul Walker, Dwayne Johnson, Michelle Rodriguez, Tyrese Gibson"
83533,Avatar: Fire and Ash,"In the wake of the devastating war against the RDA and the loss of their eldest son, Jake Sully and Neytiri face a new threat on Pandora: the Ash People, a violent and power-hungry Na'vi tribe led by the ruthless Varang. Jake's family must fight for their survival and the future of Pandora in a conflict that pushes them to their emotional and physical limits.",2025-12-17,/aabwWZWx6z1aYP4PX2ADvbDKktd.jpg,/iN41Ccw4DctL8npfmYg1j5Tr1eb.jpg,7.367,2801,213.5486,,,,James Cameron,"Sam Worthington, Zoe Saldaña, Sigourney Weaver, Stephen Lang, Oona Chaplin"
361743,Top Gun: Maverick,"After more than thirty years of service as one of the Navy’s top aviators, and dodging the advancement in rank that would ground him, Pete “Maverick” Mitchell finds himself training a detachment of TOP GUN graduates for a specialized mission the likes of which no living pilot has ever seen.",2022-05-21,/n0YuM4f5lvGAP6MAW2kBIzugXnc.jpg,/AaV1YIdWKnjAIAOe8UUKBFm327v.jpg,8.152,10823,31.9873,,,,Joseph Kosinski,"Tom Cruise, Miles Teller, Jennifer Connelly, Bashir Salahuddin, Jon Hamm"
330457,Frozen II,"Elsa, Anna, Kristoff and Olaf head far into the forest to learn the truth about an ancient mystery of their kingdom.",2019-11-20,/mINJaa34MtknCYl5AjtNJzWj8cD.jpg,/AoSZyb37ljMAxw0RdeQEBHKtgcc.jpg,7.232,10248,13.7944,,,,Jennifer Lee,"Idina Menzel, Kristen Bell, Josh Gad, Jonathan Groff, Evan Rachel Wood"
346698,Barbie,"Barbie and Ken are having the time of their lives in the colorful and seemingly perfect world of Barbie Land. However, when they get a chance to go to the real world, they soon discover the joys and perils of living among humans.",2023-07-19,/iuFNMS8U5cb6xfzi51Dbkovj7vM.jpg,/mbYTRO33LJAgpCMrIn9ibiWHbMH.jpg,6.927,11020,23.2876,,,,Greta Gerwig,"Margot Robbie, Ryan Gosling, America Ferrera, Ariana Greenblatt, Issa Rae"
99861,Avengers: Age of Ultron,"When Tony Stark tries to jumpstart a dormant peacekeeping program, things go awry and Earth’s Mightiest Heroes are put to the ultimate test as the fate of the planet hangs in the balance. As the villainous Ultron emerges, it is up to The Avengers to stop him from enacting his terrible plans, and soon uneasy alliances and unexpected action pave the way for an epic and unique global adventure.",2015-04-22,/4ssDuvEDkSArWEdyBl2X5EHvYKU.jpg,/kIBK5SKwgqIIuRKhhWrJn3XkbPq.jpg,7.27,24332,22.8654,,,,Joss Whedon,"Robert Downey Jr., Chris Hemsworth, Mark Ruffalo, Chris Evans, Scarlett Johansson"
502356,The Super Mario Bros. Movie,"While working underground to fix a water main, Brooklyn plumbers—and brothers—Mario and Luigi are transported down a mysterious pipe and wander into a magical new world. But when the brothers are separated, Mario embarks on an epic quest to find Luigi.",2023-04-05,/qNBAXBIQlnOThrVvA6mA2B5ggV6.jpg,/9n2tJBplPbgR2ca05hS5CKXwP2c.jpg,7.588,10559,61.7126,,,,Aaron Horvath,"Chris Pratt, Anya Taylor-Joy, Charlie Day, Jack Black, Keegan-Michael Key"
284054,Black Panther,"King T'Challa returns home to the reclusive, technologically advanced African nation of Wakanda to serve as his country's new leader. However, T'Challa soon finds that he is challenged for the throne by factions within his own country as well as without. Using powers reserved to Wakandan kings, T'Challa assumes the Black Panther mantle to join with ex-girlfriend Nakia, the queen-mother, his princess-kid sister, members of the Dora Milaje (the Wakandan 'special forces') and an American secret agent, to prevent Wakanda from being dragged into a world war.",2018-02-13,/uxzzxijgPIY7slzFvMotPv8wjKA.jpg,/19Ed4XgjahPm4U8JT7SnntERIlt.jpg,7.362,23406,17.3436,,,,Ryan Coogler,"Chadwick Boseman, Michael B. Jordan, Lupita Nyong'o, Danai Gurira, Martin Freeman"
12445,Harry Potter and the Deathly Hallows: Part 2,"Harry, Ron and Hermione continue their quest to vanquish the evil Voldemort once and for all. Just as things begin to look hopeless for the young wizards, Harry discovers a trio of magical objects that endow him with powers to rival Voldemort's formidable skills.",2011-07-12,/c54HpQmuwXjHq2C9wmoACjxoom3.jpg,/cbcpDn6XJaIGoOil1bKuskU8ds4.jpg,8.08,21896,18.9625,,,,David Yates,"Daniel Radcliffe, Emma Watson, Rupert Grint, Ralph Fiennes, Alan Rickman"
533535,Deadpool & Wolverine,"A listless Wade Wilson toils away in civilian life with his days as the morally flexible mercenary, Deadpool, behind him. But when his homeworld faces an existential threat, Wade must reluctantly suit-up again with an even more reluctant Wolverine.",2024-07-24,/8cdWjvZQUExUUTzyp4t6EDMubfO.jpg,/ufpeVEM64uZHPpzzeiDNIAdaeOD.jpg,7.558,8535,35.101,,,,Shawn Levy,"Ryan Reynolds, Hugh Jackman, Emma Corrin, Matthew Macfadyen, Dafne Keen"
181808,Star Wars: The Last Jedi,"Rey develops her newly discovered abilities with the guidance of Luke Skywalker, who is unsettled by the strength of her powers. Meanwhile, the Resistance prepares to do battle with the First Order.",2017-12-13,/kOVEVeg59E0wsnXmF9nrh6OmWII.jpg,/bIUaCtWaRgd78SnoHJDI8TNf7Sd.jpg,6.8,16266,28.5736,,,,Rian Johnson,"Mark Hamill, Carrie Fisher, Adam Driver, Daisy Ridley, John Boyega"
351286,Jurassic World: Fallen Kingdom,"Three years after Jurassic World was destroyed, Isla Nublar now sits abandoned. When the island's dormant volcano begins roaring to life, Owen and Claire mount a campaign to rescue the remaining dinosaurs from this extinction-level event.",2018-06-06,/x2Us3jR6ToMJjbcPbLimYoxf6xr.jpg,/6WA9stUMbIkEPxn3D5SWlA8FIi7.jpg,6.529,12703,10.4734,,,,J. A. Bayona,"Chris Pratt, Bryce Dallas Howard, Rafe Spall, Justice Smith, Daniella Pineda"
109445,Frozen,"Young princess Anna of Arendelle dreams about finding true love at her sister Elsa’s coronation. Fate takes her on a dangerous journey in an attempt to end the eternal winter that has fallen over the kingdom. She's accompanied by ice delivery man Kristoff, his reindeer Sven, and snowman Olaf. On an adventure where she will find out what friendship, courage, family, and true love really means.",2013-11-20,/itAKcobTYGpYT8Phwjd8c9hleTo.jpg,/rj58WQ9ImI0mYDptXdM7euX1Wjt.jpg,7.247,17515,18.7965,,,,Chris Buck,"Idina Menzel, Kristen Bell, Jonathan Groff, Josh Gad, Livvy Stubenrauch"
321612,Beauty and the Beast,A live-action adaptation of Disney's version of the classic tale of a cursed prince and a beautiful young woman who helps him break the spell.,2017-03-16,/hKegSKIDep2ewJWPUQD7u0KqFIp.jpg,/uU1Mt4JWhDvl4vKb3AfxNsorkoM.jpg,7.0,15972,13.688,,,,Bill Condon,"Emma Watson, Dan Stevens, Luke Evans, Kevin Kline, Emma Thompson"
260513,Incredibles 2,"Elastigirl springs into action to save the day, while Mr. Incredible faces his greatest challenge yet – taking care of the problems of his three children.",2018-06-14,/9lFKBtaVIhP7E2Pk0IY1CwTKTMZ.jpg,/mabuNsGJgRuCTuGqjFkWe1xdu19.jpg,7.451,13628,11.7384,,,,Brad Bird,"Craig T. Nelson, Holly Hunter, Sarah Vowell, Huck Milner, Catherine Keener"
337339,The Fate of the Furious,"When a mysterious woman seduces Dom into the world of crime and a betrayal of those closest to him, the crew face trials that will test them as never before.",2017-04-12,/dImWM7GJqryWJO9LHa3XQ8DD5NH.jpg,/3IJ8kG8i84PncXkSovu0PaZQfjM.jpg,6.855,10780,8.6857,,,,F. Gary Gray,"Vin Diesel, Jason Statham, Dwayne Johnson, Michelle Rodriguez, Tyrese Gibson"
68721,Iron Man 3,"When Tony Stark's world is torn apart by a formidable terrorist called the Mandarin, he starts an odyssey of rebuilding and retribution.",2013-04-18,/qhPtAc1TKbMPqNvcdXSOn9Bn7hZ.jpg,/iVped1djsF0tvGkvnHbzsE3ZPTF.jpg,6.931,23352,18.1434,,,,Shane Black,"Robert Downey Jr., Gwyneth Paltrow, Don Cheadle, Guy Pearce, Rebecca Hall"
211672,Minions,"Minions Stuart, Kevin and Bob are recruited by Scarlet Overkill, a super-villain who, alongside her inventor husband Herb, hatches a plot to take over the world.",2015-06-17,/dr02BdCNAUPVU07aOodwPYv6HCf.jpg,/wKrxeY6lbu7KFBsWVcMH6M8avwr.jpg,6.419,11063,6.8399,,,,Kyle Balda,"Sandra Bullock, Jon Hamm, Michael Keaton, Allison Janney, Steve Coogan"
271110,Captain America: Civil War,"Following the events of Age of Ultron, the collective governments of the world pass an act designed to regulate all superhuman activity. This polarizes opinion amongst the Avengers, causing two factions to side with Iron Man or Captain America, which causes an epic battle between former allies.",2016-04-27,/rAGiXaUfPzY7CDEyNKUofk3Kw2e.jpg,/7FWlcZq3r6525LWOcvO9kNWurN1.jpg,7.448,23948,18.4576,,,,Joe Russo,"Chris Evans, Robert Downey Jr., Scarlett Johansson, Sebastian Stan, Anthony Mackie"
297802,Aquaman,"Half-human, half-Atlantean Arthur Curry is taken on the journey of his lifetime to discover if he is worth of being a king.",2018-12-07,/ufl63EFcc5XpByEV2Ecdw6WJZAI.jpg,/9QusGjxcYvfPD1THg6oW3RLeNn7.jpg,6.867,14864,10.6069,,,,James Wan,"Jason Momoa, Amber Heard, Willem Dafoe, Patrick Wilson, Nicole Kidman"
429617,Spider-Man: Far From Home,"Peter Parker and his friends go on a summer trip to Europe. However, they will hardly be able to rest - Peter will have to agree to help Nick Fury uncover the mystery of creatures that cause natural disasters and destruction throughout the continent.",2019-06-28,/4q2NNj4S5dG2RLF9CpXsej7yXl.jpg,/34jW8LvjRplM8Pv06cBFDpLlenR.jpg,7.4,16882,19.9779,,,,Jon Watts,"Tom Holland, Jake Gyllenhaal, Samuel L. Jackson, Marisa Tomei, Jon Favreau"
299537,Captain Marvel,"The story follows Carol Danvers as she becomes one of the universe’s most powerful heroes when Earth is caught in the middle of a galactic war between two alien races. Set in the 1990s, Captain Marvel is an all-new adventure from a previously unseen period in the history of the Marvel Cinematic Universe.",2019-03-06,/AtsgWhDnHTq68L0lLsUrCnM7TjG.jpg,/qAzYK4YPSWDc7aa4R43LcwRIAyb.jpg,6.782,16690,14.1859,,,,Ryan Fleck,"Brie Larson, Samuel L. Jackson, Ben Mendelsohn, Jude Law, Annette Bening"
38356,Transformers: Dark of the Moon,"The Autobots continue to work for NEST, now no longer in secret. But after discovering a strange artifact during a mission in Chernobyl, it becomes apparent to Optimus Prime that the United States government has been less than forthright with them.",2011-06-28,/28YlCLrFhONteYSs9hKjD1Km0Cj.jpg,/h3js4rulxzKMOokM2oO5Kr0mBZU.jpg,6.224,8899,2.6654,,,,Michael Bay,"Shia LaBeouf, Rosie Huntington-Whiteley, Peter Cullen, Leonard Nimoy, John Turturro"
122,The Lord of the Rings: The Return of the King,"As armies mass for a final battle that will decide the fate of the world--and powerful, ancient forces of Light and Dark compete to determine the outcome--one member of the Fellowship of the Ring is revealed as the noble heir to the throne of the Kings of Men. Yet, the sole hope for triumph over evil lies with a brave hobbit, Frodo, who, accompanied by his loyal friend Sam and the hideous, wretched Gollum, ventures deep into the very dark heart of Mordor on his seemingly impossible quest to destroy the Ring of Power.​",2003-12-17,/rCzpDGLbOoPwLjy3OAm5NUPOTrC.jpg,/2u7zbn8EudG6kLlBzUYqP8RyFU4.jpg,8.496,26405,34.5875,,,,Peter Jackson,"Elijah Wood, Ian McKellen, Viggo Mortensen, Sean Astin, Andy Serkis"
37724,Skyfall,"When Bond's latest assignment goes gravely wrong, agents around the world are exposed and MI6 headquarters is attacked. While M faces challenges to her authority and position from Gareth Mallory, the new Chairman of the Intelligence and Security Committee, it's up to Bond, aided only by field agent Eve, to locate the mastermind behind the attack.",2012-10-24,/d0IVecFQvsGdSbnMAHqiYsNYaJT.jpg,/qB2eFmGEh5YCzhXUpz7As2PaDCh.jpg,7.26,16074,7.1868,,,,Sam Mendes,"Daniel Craig, Judi Dench, Javier Bardem, Ralph Fiennes, Naomie Harris"
91314,Transformers: Age of Extinction,"As humanity picks up the pieces after the battle of Chicago, a shadowy group reveals itself in an attempt to control the direction of history…while an ancient, powerful new menace sets Earth in its crosshairs. With help from Cade Yeager, Optimus Prime and the Autobots rise to meet their most fearsome challenge yet.",2014-06-25,/jyzrfx2WaeY60kYZpPYepSjGz4S.jpg,/wxr4Z6E83h14CogsZOzDm1vuDX3.jpg,5.958,8705,10.1093,,,,Michael Bay,"Mark Wahlberg, Peter Cullen, Stanley Tucci, Kelsey Grammer, Nicola Peltz"
49026,The Dark Knight Rises,"Following the death of District Attorney Harvey Dent, Batman assumes responsibility for Dent's crimes to protect the late attorney's reputation and is subsequently hunted by the Gotham City Police Department. Eight years later, Batman encounters the mysterious Selina Kyle and the villainous Bane, a new terrorist leader who overwhelms Gotham's finest. The Dark Knight resurfaces to protect a city that has branded him an enemy.",2012-07-17,/hr0L2aueqlP2BYUblTTjmtn0hw4.jpg,/y2DB71C4nyIdMrANijz8mzvQtk6.jpg,7.793,24255,17.602,,,,Christopher Nolan,"Christian Bale, Gary Oldman, Tom Hardy, Joseph Gordon-Levitt, Anne Hathaway"
475557,Joker,"During the 1980s, a failed stand-up comedian is driven insane and turns to a life of crime and chaos in Gotham City while becoming an infamous psychopathic crime figure.",2019-10-01,/udDclJoHjfjb8Ekgsd4FDteOkCU.jpg,/hO7KbdvGOtDdeg0W4Y5nKEHeDDh.jpg,8.125,27609,17.7893,,,,Todd Phillips,"Joaquin Phoenix, Robert De Niro, Zazie Beetz, Frances Conroy, Brett Cullen"
181812,Star Wars: The Rise of Skywalker,"The surviving Resistance faces the First Order once again as the journey of Rey, Finn and Poe Dameron continues. With the power and knowledge of generations behind them, the final battle begins.",2019-12-18,/db32LaOibwEliAmSL2jjDF6oDdj.jpg,/jOzrELAzFxtMx2I4uDGHOotdfsS.jpg,6.3,10780,12.525,,,,J.J. Abrams,"Carrie Fisher, Mark Hamill, Daisy Ridley, Adam Driver, John Boyega"
301528,Toy Story 4,"Woody has always been confident about his place in the world, devoted to taking care of his kid—whether that's Andy or Bonnie. But after Bonnie creates a reluctant new toy called ""Forky"", a road trip adventure alongside old and new friends challenges everything Woody believes about loyalty, purpose, and what it truly means to be a toy.",2019-06-19,/w9kR8qbmQ01HwnvK4alvnQ2ca0L.jpg,/q62bpQ67qaXY0u6b2wFEnQYIbPd.jpg,7.5,10470,13.9382,,,,Josh Cooley,"Tom Hanks, Tim Allen, Annie Potts, Tony Hale, Keegan-Michael Key"
10193,Toy Story 3,"Woody, Buzz, and the rest of Andy's toys haven't been played with in years. With Andy about to go to college, the gang find themselves accidentally left at a nefarious day care center. The toys must band together to escape and return home to Andy.",2010-06-16,/AbbXspMOwdvwWZgVN0nabZq03Ec.jpg,/uAfhsySkr1UzQg1zdg3dZQRz9Fd.jpg,7.804,15653,16.4106,,,,Lee Unkrich,"Tom Hanks, Tim Allen, Joan Cusack, Don Rickles, Wallace Shawn"
58,Pirates of the Caribbean: Dead Man's Chest,"Captain Jack Sparrow’s got a blood debt to pay: he owes his soul to the legendary Davy Jones, ghastly Ruler of the Ocean Depths. To escape eternal servitude aboard the Flying Dutchman, ever-crafty Jack must track down the still-beating heart of Jones. But he won’t do it alone: Will Turner and Elizabeth Swann are drawn back into another one of his perilous quests—assuming they can evade execution for aiding a pirate.",2006-07-06,/uXEqmloGyP7UXAiphJUu2v2pcuE.jpg,/vr6n6ZFUZvedvIlhfYcbCWcaKyW.jpg,7.375,17062,19.5346,,,,Gore Verbinski,"Johnny Depp, Orlando Bloom, Keira Knightley, Jack Davenport, Bill Nighy"
1241982,Moana 2,"After receiving an unexpected call from her wayfinding ancestors, Moana journeys alongside Maui and a new crew to the far seas of Oceania and into dangerous, long-lost waters for an adventure unlike anything she's ever faced.",2024-11-21,/aLVkiINlIeCkcZIzb7XHzPYgO6L.jpg,/zo8CIjJ2nfNOevqNajwMRO6Hwka.jpg,6.997,3041,25.6213,,,,David G. Derrick Jr.,"Auliʻi Cravalho, Dwayne Johnson, Hualālai Chung, Rose Matafeo, David Fane"
330459,Rogue One: A Star Wars Story,A rogue band of resistance fighters unite for a mission to steal the Death Star plans and bring a new hope to the galaxy.,2016-12-14,/i0yw1mFbB7sNGHCs7EXZPzFkdA1.jpg,/6t8ES1d12OzWyCGxBeDYLHoaDrT.jpg,7.5,16329,9.3362,,,,Gareth Edwards,"Felicity Jones, Diego Luna, Alan Tudyk, Donnie Yen, Jiang Wen"
420817,Aladdin,A kindhearted street urchin named Aladdin embarks on a magical adventure after finding a lamp that releases a wisecracking genie while a power-hungry Grand Vizier vies for the same lamp that has the power to make their deepest wishes come true.,2019-05-22,/ykUEbfpkf8d0w49pHh0AD2KrT52.jpg,/yJyZRrXaYUjhOrJGga8awbw4Rud.jpg,7.085,10585,11.5355,,,,Guy Ritchie,"Will Smith, Mena Massoud, Naomi Scott, Marwan Kenzari, Navid Negahban"
1865,Pirates of the Caribbean: On Stranger Tides,"When Jack crosses paths with a woman from his past, he's not sure if it's love...or if she's a ruthless con artist using him to find the fabled Fountain of Youth.",2011-05-15,/keGfSvCmYj7CvdRx36OdVrAEibE.jpg,/uzIGtyS6bbnJzGsPL93WCF1FWm8.jpg,6.566,14885,14.635,,,,Rob Marshall,"Johnny Depp, Penélope Cruz, Geoffrey Rush, Ian McShane, Kevin McNally"
552524,Lilo & Stitch,The wildly funny and touching story of a lonely Hawaiian girl and the fugitive alien who helps to mend her broken family.,2025-05-17,/ckQzKpQJO4ZQDCN5evdpKcfm7Ys.jpg,/7Zx3wDG5bBtcfk8lcnCWDOLM4Y4.jpg,7.196,2126,21.354,,,,Dean Fleischer Camp,"Maia Kealoha, Sydney Agudong, Chris Sanders, Zach Galifianakis, Billy Magnussen"
324852,Despicable Me 3,Gru and his wife Lucy must stop former '80s child star Balthazar Bratt from achieving world domination.,2017-06-15,/6t3YWl7hrr88lCEFlGVqW5yV99R.jpg,/ftRkFtAGuHngHnLiOxktq0aCVMF.jpg,6.466,7609,6.99,,,,Kyle Balda,"Steve Carell, Kristen Wiig, Trey Parker, Miranda Cosgrove, Dana Gaier"
127380,Finding Dory,Dory is reunited with her friends Nemo and Marlin in the search for answers about her past. What can she remember? Who are her parents? And where did she learn to speak Whale?,2016-06-16,/3UVe8NL1E2ZdUZ9EDlKGJY5UzE.jpg,/wijltj1toRcicHlCn8Cpsp4yPXe.jpg,7.039,12621,8.4184,,,,Andrew Stanton,"Albert Brooks, Ellen DeGeneres, Ed O'Neill, Hayden Rolence, Diane Keaton"
269149,Zootopia,"Determined to prove herself, Officer Judy Hopps, the first bunny on Zootopia's police force, jumps at the chance to crack her first case - even if it means partnering with scam-artist fox Nick Wilde to solve the mystery.",2016-02-11,/hlK0e0wAQ3VLuJcsfIYPvb4JVud.jpg,/9tOkjBEiiGcaClgJFtwocStZvIT.jpg,7.759,17994,22.7252,,,,Byron Howard,"Ginnifer Goodwin, Jason Bateman, Idris Elba, Jenny Slate, Nate Torrence"
12155,Alice in Wonderland,"Alice, now 19 years old, returns to the whimsical world she first entered as a child and embarks on a journey to discover her true destiny.",2010-03-03,/o0kre9wRCZz3jjSjaru7QU0UtFz.jpg,/ocOWbTzHcJVTw9Tz173KPeskDOP.jpg,6.639,14741,12.7002,,,,Tim Burton,"Mia Wasikowska, Johnny Depp, Anne Hathaway, Helena Bonham Carter, Crispin Glover"
