tmdb_id,title,overview,release_date,poster_path,backdrop_path,vote_average,vote_count,popularity,revenue,runtime,genres,director,actors
458723,Us,"Husband and wife Gabe and Adelaide Wilson take their kids to their beach house expecting to unplug and unwind with friends. But as night descends, their serenity turns to tension and chaos when some shocking visitors arrive uninvited.",2019-03-14,/ux2dU1jQ2ACIMShzB3yP93Udpzc.jpg,/sC0b8iPUHfZdD8kseLiHw3N8gkp.jpg,6.949,8022,7.5749,,,,Jordan Peele,"Lupita Nyong'o, Winston Duke, Elisabeth Moss, Tim Heidecker, Shahadi Wright Joseph"
575219,Pegasus,"Zhang Chi, a hubris and dominating six-time racing champion, falls from grace following a crisis. After a five-year suspension from the motorsport, the now single-father to a six-year-old boy throws down the gauntlet once again.",2019-02-05,/tPqtna4fStMA61KiWUYaeAjf22c.jpg,/smCOdLvDR54fDRStUXnxZrP9I7B.jpg,6.7,116,3.6218,,,,Han Han,"Teng Shen, Johnny Huang, Yin Zheng, Zhang Benyu, Yin Fang"
14306,Marley & Me,"A newly married couple, in the process of starting a family, learn many of life's important lessons from their trouble-loving retriever, Marley. Packed with plenty of laughs to lighten the load, the film explores the highs and lows of marriage, maturity and confronting one's own mortality, as seen through the lens of family life with a dog.",2008-12-25,/pnB6hjTKylb0Ve2nUWt16gzkErr.jpg,/tVoWbAAfTDIhTeo78SbA2V6mv8E.jpg,7.182,4780,4.8376,,,,David Frankel,"Owen Wilson, Jennifer Aniston, Eric Dane, Kathleen Turner, Alan Arkin"
419430,Get Out,"Chris and his girlfriend Rose go upstate to visit her parents for the weekend. At first, Chris reads the family's overly accommodating behavior as nervous attempts to deal with their daughter's interracial relationship, but as the weekend progresses, a series of increasingly disturbing discoveries lead him to a truth that he never could have imagined.",2017-02-24,/mE24wUCfjK8AoBBjaMjho7Rczr7.jpg,/o8dPH0ZSIyyViP6rjRX1djwCUwI.jpg,7.622,18795,12.9111,,,,Jordan Peele,"Daniel Kaluuya, Allison Williams, Catherine Keener, Bradley Whitford, Caleb Landry Jones"
9350,Cliffhanger,"A year after losing his friend in a tragic 4,000-foot fall, former ranger Gabe Walker and his partner, Hal, are called to return to the same peak to rescue a group of stranded climbers, only to learn the climbers are actually thieving hijackers who are looking for boxes full of money.",1993-05-28,/b28DOM54OHb1c7Lsk6Nu7Kwuonj.jpg,/hPTaANKrpghMQeRIOcPJbJA4Yia.jpg,6.515,2614,5.186,,,,Renny Harlin,"Sylvester Stallone, John Lithgow, Michael Rooker, Janine Turner, Rex Linn"
1022796,Wish,"Asha, a sharp-witted idealist, makes a wish so powerful that it is answered by a cosmic force – a little ball of boundless energy called Star. Together, Asha and Star confront a most formidable foe - the ruler of Rosas, King Magnifico - to save her community and prove that when the will of one courageous human connects with the magic of the stars, wondrous things can happen.",2023-11-13,/nesuSdJakNkf0zs7OfoasB6Clxf.jpg,/ehumsuIBbgAe1hg343oszCLrAfI.jpg,6.2,1767,7.2529,,,,Fawn Veerasunthorn,"Ariana DeBose, Chris Pine, Alan Tudyk, Angelique Cabral, Victor Garber"
748783,The Garfield Movie,"Garfield, the world-famous, Monday-hating, lasagna-loving indoor cat, is about to have a wild outdoor adventure! After an unexpected reunion with his long-lost father – scruffy street cat Vic – Garfield and his canine friend Odie are forced from their perfectly pampered life into joining Vic in a hilarious, high-stakes heist.",2024-04-30,/xYduFGuch9OwbCOEUiamml18ZoB.jpg,/P82NAcEsLIYgQtrtn36tYsj41m.jpg,6.996,1424,11.2788,,,,Mark Dindal,"Chris Pratt, Samuel L. Jackson, Hannah Waddingham, Ving Rhames, Nicholas Hoult"
383785,Kung Fu Yoga,"Two professors team up to locate a lost treasure and embark on an adventure that takes them from a Tibetan ice cave to Dubai, and to a mountain temple in India.",2017-01-27,/rL6XM4fsr1cM5mN2flEhQ8jQter.jpg,/usGRxcuvOCXiI5kQm0H3EKSmTxb.jpg,5.873,430,2.8939,,,,Stanley Tong Gwai-Lai,"Jackie Chan, Aarif Rahman, Zhang Yixing, Miya Muqi, Sonu Sood"
9598,Babe,"Babe is a little pig who doesn't quite know his place in the world. With a bunch of odd friends, like Ferdinand the duck who thinks he is a rooster and Fly the dog he calls mum, Babe realises that he has the makings to become the greatest sheep pig of all time, and Farmer Hoggett knows it. With the help of the sheep dogs, Babe learns that a pig can be anything that he wants to be.",1995-07-18,/zKuQMtnbVTz9DsOnOJmlW71v4qH.jpg,/agkZziO4ZPAsVfKUrJD68lys08P.jpg,6.267,3099,6.7938,,,,Chris Noonan,"Christine Cavanaugh, Miriam Margolyes, Danny Mann, Hugo Weaving, Miriam Flynn"
479455,Men in Black: International,"The Men in Black have always protected the Earth from the scum of the universe. In this new adventure, they tackle their biggest, most global threat to date: a mole in the Men in Black organization.",2019-06-12,/dPrUPFcgLfNbmDL8V69vcrTyEfb.jpg,/uK9uFbAwQ1s2JHKkJ5l0obPTcXI.jpg,5.897,5320,7.1762,,,,F. Gary Gray,"Chris Hemsworth, Tessa Thompson, Kumail Nanjiani, Rebecca Ferguson, Rafe Spall"
945664,Lighting Up the Stars,"Having been released after serving his sentence, a funeral director accidentally crosses paths with a girl which brings about an unexpected change in his attitude towards life.",2022-06-24,/xHTGLYpZKfwGJ0lM2NEAmb6DdYi.jpg,/jDJ8iCLMBLhoznsXh9SEjpnQCdx.jpg,7.462,53,1.4408,,,,Liu Jiangjiang,"Zhu Yilong, Yang Enyou, Wang Ge, Liu Lu, Li Chunai"
11199,Wild Hogs,"Restless and ready for an adventure, four suburban bikers leave the safety of their subdivision and head out on the open road. But complications ensue when they cross paths with an intimidating band of New Mexico bikers known as the Del Fuegos.",2007-03-02,/qYyPCZcpNGZwbyBo1gwdCiW5hHC.jpg,/es74vwJqbT6cwMdJmTeSIcjJjoo.jpg,5.969,2440,5.8758,,,,Walt Becker,"Tim Allen, John Travolta, Martin Lawrence, William H. Macy, Ray Liotta"
11887,High School Musical 3: Senior Year,"As seniors in high school, Troy and Gabriella struggle with the idea of being separated from one another as college approaches. Along with the rest of the Wildcats, they stage a spring musical to address their experiences, hopes and fears about their future.",2008-10-11,/aq2o1wT0crBOTxof36O6KTyjpgE.jpg,/1czvi8gsu675rH2XjSxHyPBUv95.jpg,6.542,3595,2.8943,,,,Kenny Ortega,"Zac Efron, Vanessa Hudgens, Ashley French, Lucas Grabeel, Corbin Bleu"
11970,Hercules,"Bestowed with superhuman strength, a young mortal named Hercules sets out to prove himself a hero in the eyes of his father, the great god Zeus. Along with his friends Pegasus, a flying horse, and Phil, a personal trainer, Hercules is tricked by the hilarious, hotheaded villain Hades, who's plotting to take over Mount Olympus!",1997-06-13,/dK9rNoC97tgX3xXg5zdxFisdfcp.jpg,/oG9dcGSSu13fjFp1Uly15ZXjRKV.jpg,7.491,7889,13.9509,,,,Ron Clements,"Tate Donovan, Josh Keaton, Roger Bart, Danny DeVito, James Woods"
1089654,Chang'an,"A few years after the Anshi Rebellion, Tang dynasty military commander Gao Shi suffers a defeat in a battle threatening Chang'an. Trapped in the besieged city, he recalls his lifelong friendship with the acclaimed poet Li Bai.",2023-07-02,/ltWuj0bEhITpiNYaTmpc2lUKy90.jpg,/m4sS3YPOu6OPHzwJcPKjMH1TyRA.jpg,7.7,65,2.1714,,,,Xie Junwei,"Yang Tianxiang, Ling Zhenhe, Junquan Wu, Xuan Xiaoming, Lu Lifeng"
320288,Dark Phoenix,"The X-Men face their most formidable and powerful foe when one of their own, Jean Grey, starts to spiral out of control. During a rescue mission in outer space, Jean is nearly killed when she's hit by a mysterious cosmic force. Once she returns home, this force not only makes her infinitely more powerful, but far more unstable. The X-Men must now band together to save her soul and battle aliens that want to use Grey's new abilities to rule the galaxy.",2019-06-05,/cCTJPelKGLhALq3r51A9uMonxKj.jpg,/cjRUhKyt2Jo3V1KNzc5tpPNfccG.jpg,5.964,7040,8.2064,,,,Simon Kinberg,"Sophie Turner, James McAvoy, Nicholas Hoult, Tye Sheridan, Michael Fassbender"
44264,True Grit,"Following the murder of her father by a hired hand, a 14-year-old farm girl sets out to capture the killer. To aid her, she hires the toughest U.S. Marshal she can find—a man with 'true grit'—Reuben J. 'Rooster' Cogburn.",2010-12-22,/tCrB8pcjadZjsDk7rleGJaIv78k.jpg,/5dwlH8Krm2bsuc2Pubw2cBb03g5.jpg,7.305,5723,6.6998,,,,Ethan Coen,"Jeff Bridges, Hailee Steinfeld, Matt Damon, Josh Brolin, Barry Pepper"
448119,Dolittle,"After losing his wife seven years earlier, the eccentric Dr. John Dolittle, famed doctor and veterinarian of Queen Victoria’s England, hermits himself away behind the high walls of Dolittle Manor with only his menagerie of exotic animals for company. But when the young queen falls gravely ill, a reluctant Dolittle is forced to set sail on an epic adventure to a mythical island in search of a cure, regaining his wit and courage as he crosses old adversaries and discovers wondrous creatures.",2020-01-02,/3Nt3v1uzUgfSuVARD1AnI9g9Zl9.jpg,/xcUf6yIheo78btFqihlRLftdR3M.jpg,6.577,3859,7.406,,,,Stephen Gaghan,"Robert Downey Jr., Harry Collett, Michael Sheen, Jim Broadbent, Antonio Banderas"
1281,Bean,"Childlike Englishman, Mr. Bean, is an incompetent watchman at the Royal National Gallery. After the museum's board of directors' attempt to have him fired is blocked by the chairman, who has taken a liking to Bean, they send him to Los Angeles to act as their ambassador for the unveiling of a historic painting to humiliate him. Fooled, Mr. Bean must now successfully unveil the painting or risk his and a hapless Los Angeles curator's termination.",1997-07-03,/IwrDPrB4d2DMcpnGkvan46yINL.jpg,/rHTAgPq6ZGoj5CqxFAh04Q3hJWH.jpg,6.47,2577,4.6614,,,,Mel Smith,"Rowan Atkinson, Peter MacNicol, Pamela Reed, Tricia Vessey, Andrew Lawrence"
168672,American Hustle,"A conman and his seductive partner are forced to work for a wild FBI agent, who pushes them into a world of Jersey power-brokers and the Mafia.",2013-12-03,/z6O1KDhfWDTm5ZBr6Ovr0eg8LqO.jpg,/bof71DUdBb5FwTylar4rnIVd8z.jpg,6.856,7711,6.1036,,,,David O. Russell,"Christian Bale, Bradley Cooper, Amy Adams, Jeremy Renner, Jennifer Lawrence"
9489,You've Got Mail,Book superstore magnate Joe Fox and independent book shop owner Kathleen Kelly fall in love in the anonymity of the Internet—both blissfully unaware that he's trying to put her out of business.,1998-12-18,/e2uVtH6TpMfUl7WeOM70ezkcjsU.jpg,/wZM9vnatKefMHUNolmGMTr8sZrd.jpg,6.702,3618,5.4969,,,,Nora Ephron,"Meg Ryan, Tom Hanks, Greg Kinnear, Parker Posey, Heather Burns"
508,Love Actually,Eight very different couples deal with their love lives in various loosely interrelated tales all set during a frantic month before Christmas in London.,2003-09-07,/7QPeVsr9rcFU9Gl90yg0gTOTpVv.jpg,/xUWf5xX0AnZgAnYXAMk03zTbsef.jpg,7.096,7359,7.9181,,,,Richard Curtis,"Hugh Grant, Alan Rickman, Emma Thompson, Liam Neeson, Martine McCutcheon"
9798,Enemy of the State,"When the videotape of the murder of a congressman unknowingly ends up in the hands of labor lawyer and dedicated family man Robert Clayton Dean, he is framed for the murder. With the help of the mysterious Brill, Dean attempts to throw the NSA off his trail and prove his innocence.",1998-11-20,/x9pXrMKLsBGGOFyyZ0Gwt9YpVub.jpg,/dPVB14zM1KVLNtAhXxumJbHFXtg.jpg,7.062,4224,5.2669,,,,Tony Scott,"Will Smith, Gene Hackman, Jon Voight, Regina King, Loren Dean"
678512,Sound of Freedom,"The story of Tim Ballard, a former US government agent, who quits his job in order to devote his life to rescuing children from global sex traffickers.",2023-07-03,/qA5kPYZA7FkVvqcEfJRoOy4kpHg.jpg,/7JqWWLCajnt6XWCrRlgvtsYP0u6.jpg,7.955,2735,6.1651,,,,Alejandro Monteverde,"Jim Caviezel, Mira Sorvino, Bill Camp, Gerardo Taracena, Kurt Fuller"
2486,Eragon,"In his homeland of Alagaesia, a farm boy happens upon a dragon's egg -- a discovery that leads him on a predestined journey where he realized he's the one person who can defend his home against an evil king.",2006-12-14,/mNu6QLUnKqPIjRA3pgEb5dkJye6.jpg,/2GB3sdsWn3drlkwGMMNQ3KFNbIV.jpg,5.126,3435,6.5618,,,,Stefen Fangmeier,"Ed Speleers, Jeremy Irons, Sienna Guillory, Robert Carlyle, John Malkovich"
10009,Brother Bear,"When an impulsive boy named Kenai is magically transformed into a bear, he must literally walk in another's footsteps until he learns some valuable life lessons. His courageous and often zany journey introduces him to a forest full of wildlife, including the lovable bear cub Koda, hilarious moose Rutt and Tuke, woolly mammoths and rambunctious rams.",2003-10-23,/otptPbEY0vBostmo95xwiiumMJm.jpg,/sZhY0BAsN1bMAPLIqMRqG1fqb3A.jpg,7.273,5725,10.6609,,,,Aaron Blaise,"Joaquin Phoenix, Jeremy Suarez, Jason Raize, Rick Moranis, Dave Thomas"
9342,The Mask of Zorro,"It has been twenty years since Don Diego de la Vega fought Spanish oppression in Alta California as the legendary romantic hero, Zorro. Having escaped from prison he transforms troubled bandit Alejandro into his successor, in order to foil the plans of the tyrannical Don Rafael Montero who robbed him of his freedom, his wife and his precious daughter.",1998-07-16,/bdMufwGDDzqu4kTSQwrKc5WR4bu.jpg,/wn0e4o0FYd2cBouOviUeTOWzL89.jpg,6.6,4312,6.0675,,,,Martin Campbell,"Antonio Banderas, Anthony Hopkins, Catherine Zeta-Jones, Stuart Wilson, Matt Letscher"
2300,Space Jam,"With their freedom on the line, the Looney Tunes seek the help of NBA superstar Michael Jordan to win a basketball game against a team of moronic aliens.",1996-11-15,/4RN5El3Pj2W4gpwgiAGLVfSJv2g.jpg,/lWybXICZZpxnSvWSOW53XxTERUg.jpg,6.808,6384,6.9118,,,,Joe Pytka,"Michael Jordan, Wayne Knight, Theresa Randle, Manner Washington, Eric Gordon"
629542,The Bad Guys,"When the Bad Guys, a crew of criminal animals, are finally caught after years of heists and being the world’s most-wanted villains, Mr. Wolf brokers a deal to save them all from prison.",2022-03-17,/7qop80YfuO0BwJa1uXk1DXUUEwv.jpg,/9IDJpHROaC0S1ZlIxrvzOcOX5yC.jpg,7.5,2528,9.8952,,,,Pierre Perifel,"Sam Rockwell, Marc Maron, Awkwafina, Craig Robinson, Anthony Ramos"
12289,Red Cliff,"In 208 A.D., in the final days of the Han Dynasty, shrewd Prime Minster Cao convinced the fickle Emperor Han the only way to unite all of China was to declare war on the kingdoms of Xu in the west and East Wu in the south. Thus began a military campaign of unprecedented scale. Left with no other hope for survival, the kingdoms of Xu and East Wu formed an unlikely alliance.",2008-07-10,/eEelFTjUYJJDlwqd53VfSA8xMfj.jpg,/pkcW3uu862e41ol1JXEVP4RSo0N.jpg,7.118,882,3.6012,,,,John Woo,"Tony Leung Chiu-wai, Takeshi Kaneshiro, Zhang Fengyi, Chang Chen, Vicky Zhao"
1198553,Nidja's Kitchen 2,The times have been rough on our cooking show host yet he still persists in his passion for harming others,2020-10-13,/dmT3uT19MtYYnBlh7ukBp8kM7qA.jpg,,0.0,0,0.0071,,,,Mihajlo Tornjanski,"Nikola Samardžić, Jovan Bogdanović"
565,The Ring,Journalist Rachel Keller investigates a strange videotape that may be behind the untimely deaths of four teenagers. There is an urban legend about this tape: the viewer will die seven days after watching it. Rachel tracks down the video... and watches it. Now she has just seven days to unravel the mystery of the Ring in order to save herself and her son.,2002-10-18,/AeRpUynJKDpJveklBJipOYrVxCS.jpg,/6tuNQ16hC4Qp7wjTweKzUnnLBkI.jpg,6.7,6638,9.2521,,,,Gore Verbinski,"Naomi Watts, Martin Henderson, David Dorfman, Brian Cox, Jane Alexander"
435800,Journey to the West: The Demons Strike Back,"Tang Monk brings three disciples on a journey to the West. On the outside, everything seems harmonious. However, tension is present beneath the surface, and their hearts and minds are not in agreement. After a series of demon-capturing events, the monk and his disciples gain mutual understanding of each others' hardships and unease. Finally, they resolve their inner conflict and work together to become an all-conquering, demon-exorcising team.",2017-01-28,/8YcgbJatxoBjQqQHF52NdcdkIJZ.jpg,/53S8ZkcMMuqXTrXi45pzBjuA0Ak.jpg,5.888,134,3.8237,,,,Tsui Hark,"Kris Wu, Lin Gengxin, Yao Chen, Lin Yun, Mengke Bateer"
2667,The Blair Witch Project,"In October of 1994 three student filmmakers disappeared in the woods near Burkittsville, Maryland, while shooting a documentary. A year later their footage was found.",1999-07-14,/9050VGrYjYrEjpOvDZVAngLbg1f.jpg,/ghPJw3XfhELokIf6V5QL0VpsXtK.jpg,6.364,5393,7.219,,,,Daniel Myrick,"Heather Donahue, Joshua Leonard, Michael C. Williams, Bob Griffin, Jim King"
109451,Cloudy with a Chance of Meatballs 2,"After the disastrous food storm in the first film, Flint and his friends are forced to leave the town. Flint accepts the invitation from his idol Chester V to join The Live Corp Company, which has been tasked to clean the island, and where the best inventors in the world create technologies for the betterment of mankind. When Flint discovers that his machine still operates and now creates mutant food beasts like living pickles, hungry tacodiles, shrimpanzees and apple pie-thons, he and his friends must return to save the world.",2013-09-26,/ss5NcK2NWFg2YcKKYXLrk8q1myS.jpg,/vWriOBVlgW0XWdgbOiijhyLW7B8.jpg,6.453,3462,7.3552,,,,Kris Pearn,"Bill Hader, Anna Faris, James Caan, Will Forte, Andy Samberg"
9741,Unbreakable,"An ordinary man makes an extraordinary discovery when a train accident leaves his fellow passengers dead — and him unscathed. The answer to this mystery could lie with the mysterious Elijah Price, a man who suffers from a disease that renders his bones as fragile as glass.",2000-11-22,/mLuehrGLiK5zFCyRmDDOH6gbfPf.jpg,/A7CYNTa3fWyU0t207XiecgriQv5.jpg,7.143,9886,6.8546,,,,M. Night Shyamalan,"Bruce Willis, Samuel L. Jackson, Robin Wright, Spencer Treat Clark, Charlayne Woodard"
8467,Dumb and Dumber,"Lloyd and Harry are two men whose stupidity is really indescribable. When Mary, a beautiful woman, loses an important suitcase with money before she leaves for Aspen, the two friends (who have found the suitcase) decide to return it to her. After some ""adventures"" they finally get to Aspen where, using the lost money they live it up and fight for Mary's heart.",1994-12-16,/4LdpBXiCyGKkR8FGHgjKlphrfUc.jpg,/9FeYBZDvNTh4ZmweekJvwyIxIiL.jpg,6.7,6684,9.7623,,,,Peter Farrelly,"Jim Carrey, Jeff Daniels, Lauren Holly, Teri Garr, Charles Rocket"
109418,Grown Ups 2,"Lenny has relocated his family back to the small town where he and his friends grew up. This time around, the grown ups are the ones learning lessons from their kids on a day notoriously full of surprises—the last day of school.",2013-07-11,/hT6ijOtjtYrnyDhN7VA2QWyGFAm.jpg,/7JhsJxNmdW0y4IyNrHy10cECrAz.jpg,6.142,4640,12.291,,,,Dennis Dugan,"Adam Sandler, Kevin James, Chris Rock, David Spade, Salma Hayek Pinault"
450465,Glass,"In a series of escalating encounters, former security guard David Dunn uses his supernatural abilities to track Kevin Wendell Crumb, a disturbed man who has twenty-four personalities. Meanwhile, the shadowy presence of Elijah Price emerges as an orchestrator who holds secrets critical to both men.",2019-01-16,/svIDTNUoajS8dLEo7EosxvyAsgJ.jpg,/rzsMWXQ7GaN60wIpg3yf01iBmXy.jpg,6.665,9046,8.0805,,,,M. Night Shyamalan,"James McAvoy, Bruce Willis, Samuel L. Jackson, Sarah Paulson, Anya Taylor-Joy"
227973,The Peanuts Movie,"Snoopy embarks upon his greatest mission as he and his team take to the skies to pursue their arch-nemesis, while his best pal Charlie Brown begins his own epic quest.",2015-11-05,/aiwdwnl7RFs1vcBanOKr13ye3wE.jpg,/361quVX94drEaExOKScbZYsxijG.jpg,6.961,1780,4.8602,,,,Steve Martino,"Noah Schnapp, Bill Melendez, Marleik 'Mar Mar' Walker, Alex Garfin, Hadley Belle Miller"
44896,Rango,"When Rango, a lost family pet, accidentally winds up in the gritty, gun-slinging Western town of Dirt, the theater-loving lizard suddenly finds himself the newly appointed sheriff. Welcomed as the last hope the town has been waiting for, Rango is forced to play his new role to the hilt and uncover the truth behind a looming water crisis—before his act catches up with him.",2011-03-02,/A5MP1guV8pbruieG0tnpPIbaJtt.jpg,/mOtKQlXdL5J4lwqcSFlkZmgmFeZ.jpg,6.893,7046,10.3943,,,,Gore Verbinski,"Johnny Depp, Isla Fisher, Ned Beatty, Bill Nighy, Abigail Breslin"
712,Four Weddings and a Funeral,"Over the course of five social occasions, a committed bachelor must consider the notion that he may have discovered love.",1994-03-09,/qa72G2VS0bpxms6yo0tI9vsHm2e.jpg,/ejFaHWnDP29z7ePw2cJVOsWvOvH.jpg,6.8,2984,5.5712,,,,Mike Newell,"Hugh Grant, Andie MacDowell, Kristin Scott Thomas, Simon Callow, James Fleet"
754,Face/Off,"In order to foil a terrorist plot, an FBI agent undergoes facial transplant surgery and assumes the identity of a criminal mastermind. The plan turns sour when the criminal wakes up prematurely and seeks revenge.",1997-06-27,/69Xzn8UdPbVnmqSChKz2RTpoNfB.jpg,/tsSWHgaFlzzkp3o976juBZbmcs2.jpg,7.055,5852,8.8455,,,,John Woo,"John Travolta, Nicolas Cage, Joan Allen, Alessandro Nivola, Gina Gershon"
308531,Teenage Mutant Ninja Turtles: Out of the Shadows,"After supervillain Shredder escapes custody, he joins forces with mad scientist Baxter Stockman and two dimwitted henchmen, Bebop and Rocksteady, to unleash a diabolical plan to take over the world. As the Turtles prepare to take on Shredder and his new crew, they find themselves facing an even greater evil with similar intentions: the notorious Krang.",2016-05-30,/euVaCiCWz3AALcQXHT6aUqdGUo6.jpg,/41objfan7PDTBG5MFXQl4ownQzJ.jpg,6.049,3772,5.9916,,,,Dave Green,"Pete Ploszek, Alan Ritchson, Jeremy Howard, Noel Fisher, Megan Fox"
62213,Dark Shadows,Vampire Barnabas Collins is inadvertently freed from his tomb and emerges into the very changed world of 1972. He returns to Collinwood Manor to find that his once-grand estate and family have fallen into ruin.,2012-05-09,/fd9Ck4cxVlmtXsbeGtQW7WFuUFI.jpg,/cJYerfZVf2rNwfGMK3MQ8lTbMnY.jpg,6.098,7590,6.9142,,,,Tim Burton,"Johnny Depp, Michelle Pfeiffer, Eva Green, Helena Bonham Carter, Chloë Grace Moretz"
1927,Hulk,"Bruce Banner, a genetics researcher with a tragic past, suffers massive radiation exposure in his laboratory that causes him to transform into a raging green monster when he gets angry.",2003-06-19,/UllIft2jLSBaay3zQyMV4GNdfy.jpg,/8vQBXqDbb30qNpBcNYwTesSg75.jpg,5.579,6234,8.7914,,,,Ang Lee,"Eric Bana, Jennifer Connelly, Sam Elliott, Josh Lucas, Nick Nolte"
605375,The Bravest,"Based on real life events, the film revolves around the heroic efforts of a team of firefighters as they attempt to deal with a fire that breaks out at an oil refinery in Dalian.",2019-08-29,/wuFHsaAyTxbCBXDDXuvbaUqFxwz.jpg,/cJIpMrrTyW922r7FaRMihWL8Kyq.jpg,7.155,87,2.2676,,,,Tony Chan,"Huang Xiaoming, Du Jiang, Tan Zhuo, Yang Zi, Ou Hao"
8265,Welcome to the Sticks,"Although living a comfortable life in Salon-de-Provence, a charming town in the South of France, Julie has been feeling depressed for a while. To please her, Philippe Abrams, a post office administrator, her husband, tries to obtain a transfer to a seaside town, on the French Riviera, at any cost. The trouble is that he is caught red-handed while trying to scam an inspector. Philippe is immediately banished to the distant unheard of town of Bergues, in the Far North of France...",2008-02-20,/cnUkc60SkI1PCY1SyfLFpZc0T7C.jpg,/sBmLZreEkVK3bc6LLEyZFgKuxjk.jpg,6.703,2567,3.9554,,,,Dany Boon,"Kad Merad, Dany Boon, Zoé Félix, Lorenzo Ausilia-Foret, Anne Marivin"
238,The Godfather,"Spanning the years 1945 to 1955, a chronicle of the fictional Italian-American Corleone crime family. When organized crime family patriarch, Vito Corleone barely survives an attempt on his life, his youngest son, Michael steps in to take care of the would-be killers, launching a campaign of bloody revenge.",1972-03-14,/3bhkrj58Vtu7enYsRolD1fZdja1.jpg,/tSPT36ZKlP2WVHJLM4cQPLSzv3b.jpg,8.686,22833,39.9109,,,,Francis Ford Coppola,"Marlon Brando, Al Pacino, James Caan, Robert Duvall, Richard S. Castellano"
257344,Pixels,Video game experts are recruited by the military to fight 1980s-era video game characters who've attacked New York.,2015-07-16,/d26S5EfVXLNxRXqyFy1yyl3qRq3.jpg,/41Y3h2FVfoU4baFdTZwRrlD4MDM.jpg,5.771,8006,11.9055,,,,Chris Columbus,"Adam Sandler, Kevin James, Michelle Monaghan, Peter Dinklage, Josh Gad"
184315,Hercules,"When a new enemy threatens the innocent, Hercules must lead his fearless team of warriors in a battle against overwhelming odds.",2014-07-23,/sKNIwY6UENCJ36FvYvnBW3Vdzt7.jpg,/nl18gyzai02Tu99VkURu7kCFrR8.jpg,5.799,4325,13.0681,,,,Brett Ratner,"Dwayne Johnson, Ian McShane, John Hurt, Rufus Sewell, Aksel Hennie"
2109,Rush Hour,"When Hong Kong Inspector Lee is summoned to Los Angeles to investigate a kidnapping, the FBI doesn't want any outside help and assigns cocky LAPD Detective James Carter to distract Lee from the case. Not content to watch the action from the sidelines, Lee and Carter form an unlikely partnership and investigate the case themselves.",1998-09-18,/3WsLE6FtxEPRa6U9sbY1ckrn39s.jpg,/9FrpAtF87VKblKkDEiIZzYgO40K.jpg,7.064,5610,13.1031,,,,Brett Ratner,"Jackie Chan, Chris Tucker, Tom Wilkinson, Philip Baker Hall, Elizabeth Peña"
196,Back to the Future Part III,"The final installment finds Marty digging the trusty DeLorean out of a mineshaft and looking for Doc in the Wild West of 1885. But when their time machine breaks down, the travelers are stranded in a land of spurs. More problems arise when Doc falls for pretty schoolteacher Clara Clayton, and Marty tangles with Buford Tannen.",1990-05-25,/crzoVQnMzIrRfHtQw0tLBirNfVg.jpg,/AtF7TESJEMmImBRUj9Z7HmW2ZH0.jpg,7.492,11463,7.2136,,,,Robert Zemeckis,"Michael J. Fox, Christopher Lloyd, Mary Steenburgen, Thomas F. Wilson, Lea Thompson"
